text,star
대한극장5관에서 봤습니다. 중간에 5번 이상 음향이 끊기면서 집중에 방해가 되었어요. 대한극장이 늘 다양한 영화를 상연해서 고맙긴한데.. 관리 좀 ㅠ ㅠ   영화는 최고 입니다.  잔잔하고 많은 생각을 하게 합니다.움직여라~~  여러생각을 하게 합니다. 보신분은  아실듯 ㅎㅎ ,10
 너무 재밌게봤다 남친따라 억지로 갔던건데.. ,10
잔잔하게 이어지는 이야기.  시골마을의 이쁜 자연도 하나의 볼거리. ,10
일단 아이들이 재미있게 봐서....돈 아깝지 않게 잘 봤습니다. ,8
몇번을 봐도 볼때마다 감탄과 감동의 눈물을 흘리게 됩니다.. 감사합니다. 이런 훌륭한 영화를 만들어주셔서.. ,10
역사적 이야기를 유쾌하면서도 진중하게 잘 다룬 영화입니다! 감명적이었어요ㅎㅎ ,10
나무랄 데 없는 수작입니다.  더 많은 사람들이 보았으면... 장영실의 발명기가 아닌 세종 영실 두 사람의 신분을 뛰어넘은 우정이 주제라고 봅니다.  그런 면에서는 아주 잘 풀어낸 이야기라고 생각해요 ,10
멋진 상남자들이 많이 나와서 좋았습니다. ,8
천재 소리가 듣고 싶은게냐 ,4
,10
연기력에 두시간이 넘는 시간에도 몰입하여 관람했습니다역사를 잘 몰라도 재밌습니다!! ,10
잔잔한 감동에 좋아하는 배우들때문에 보기에는 나쁘지 않았다.하지만 중간에 톡톡 쏘는 재미가 없고 평범한 재난영화 그자체..많이 아쉽다.. ,8
넘재미있어요 ,7
평점에 하도 욕을 많이 보고 봐서 그런가 볼만하던데 ㅋㅋ 재미없다는 사람은 맴버 보고 너무 기대가 컷는듯 ,8
액션 참 좋네요 재미있습니다 ,10
늦었지만 재밌게 봤습니다~ ,10
직접보고왔는데 이케 악플달릴영화는 아닌데악플이 너무 많네요 전잼나게 잘보고 왔네요 ,9
메모리 부르면서 콧물 흘리는거 너무 더러워 토나올 뻔 했다 ,2
아주 현실적이라 더 불편한 하지만 공감되는 영화 ,9
진짜 재밌게 봄!!! 많이 알려졌으면 좋겠다 ,10
,10
출연배우들의 연기력이 돋보이는 영화였습니다.세종대왕님 덕분에 이렇게 한글로 후기도 남기네요. ,7
영화 끝나자 마자 사람들 하품하는거 보는게 더 재밌음 ㅋㅋㅋㅋ옆사람은 계속 핸드폰으로 시간보더라 ㅋㅋ언제 끝나나~ ,1
,9
고증을 잘한 해전 영화.전쟁씬이 매우 풍부해서 볼거리가 많았다. ,8
배우들이 워낙 연기력이 좋다. 강윤성 감독의 다음 작품이 기다려진다 ,10
,10
역사적 사건 고증에 충실한 수작! 이게 왜 백두산보다 흥행이 저조한지... ,10
연초 첫영화로 봤는데 대성공입니다!! ,10
,10
"크리스마스 영화라길래 아무생각없이 예매하고 보러갔다. 에밀리아 클라크 나온다고 하니 뭐... 첨에 보다보니 ""에이 뭐 그냥 푼수가 사람되는 얘긴가보네"" 하고 대충 보다보니 어느새 울고 있더라.. 나만 감동적인진 모르겠지만.. 스토리가 감동적이었음... 엄마 러시아말 ㅋㅋ ",10
,10
연기력에 빠져서 시간가는줄 모르고 봤습니다.옆에 여자친구는 자더라구요..ㅎㅎ ,10
빨간색 표적이 있어 명중하기 쉬웠을듯. ,10
재밌고  감동 코믹 지루하지 않고 이병헌 멋있다 ,10
영화보다 오랜만에 감동 받네ㅎ ,10
전장에만 초점을 맞추지 않은 전쟁에 임하는 개개인들의 심경변화나 정보전의 중요성도 다룬 점을 생각해보면 괜찮은 연출이었다 뭣보다 미국의 시각에서 서술한 영화지만 패전국 내지는 적국의 입장인 일본에 대한 연출도 담담한 어조로 중립적이고 객관적으로 했다는 점에서 칭찬하고 싶다 ,9
잼남. 백두산좀 내립시다..갸 때문에 다른영화 상영관 찾기 힘듦. ,9
실사화 때문에 어쩔 수 없다지만 원숭이 앵무새 호랑이 양탄자의 등장과 연기가 많이 줄어든 부분이 아쉽네요 특히 양탄자는 만화에선 생사고락을 함께하는 동료같은 느낌인데 영화에서는 그냥 도구였음 ,9
너무 재미있고 모든 노래가 좋고 너무 멋있어요 ,10
백두산말고 이거보자 비교가안되 ,10
,10
"20년전 당대 최고의 인기배우 한석규가 신인감독 허진호를 세상에 소개했다면, 20년후 감독 허진호는 배우 한석규를 레전드의 반열에 올려놓았다. ",9
최고 인생작. 하나만 꼽아야 한다면 이 영화다. ,10
근래에 본 한국영화중 최고라고 단언합니다 ,10
진지하게 보다가 풀잠때렸다 이게 영화냐? ,1
이건 Face off... ,4
이병헌 하정우 연기잘하구 수지이뿜 ,6
영화 보면서 중간 중간 코믹하게 하지만 결코 재미로 보는거 보단 생각을 깊게 하는영화 오랜만에 잘 만들었단 생각이 ~~ ,10
언젠가부터 빨갱이가 판치기 시작했다 ,5
아이호퓨쇼호샤푸라갸 ,10
유튜브에서 과거 미드웨이에 대한 배경을 한 번 보시고 영화를 보시면 장면장면 이해가 빠르게 되실겁니다. 영화 재밌어요~ ,10
,10
4DX로 봤는데 그냥 그랬다. 그런데!! 우리가 돗단배 탈때 일본은 세계최고의 항공모함과 전함을 갖추고 있다는 사실에 일본을 본받아야 한다고 다시 느꼈다. ,6
너무나 재밌다 한석규배우님의 연기를 보며 물음표 남발 2020년대 우리랑 같은 사람인데 어찌저렇게 표현하시고 연기하시는걸까 한석규배우님 진짜 픽! ,10
박정민 님 보려고 틀었다가 너무 슬프고 화가 나서 울었네요 ,10
ㅋㅋㅋㅋ아직 영화는안봤지만 저정도배우로 구라안치고 내가 감독해도 100만은 걍뽑을듯 ,10
정주행 3번이상함 인생드라마. 노을 OST도 진짜 좋음. 뭐 하나 빠지는게없이 완벽한 드라마라고 생각함. 양강칠그자체.. 킹갓우성이형 ,10
분명 서로 싫어진 것은 아닌데 신뢰가 깨진 것이 큰 것 같다. ,8
하...20년전 영화 아마겟돈과 비교하며 잠이 들었다 ,4
루즈한 장면없이 완전 재밌습니다. ,10
"꽃뱀을 페미니스트로 포장한 영화.  범죄영화지만 긴장감 제로, 오락영화지만 웃음 제로, ",4
,10
역사영화여서 그다지 기대하지 않고 봤는데 정말 배우들의 연기로인해 영화속으로 빠져들 수 밖에 없습니다.  허구적 요소가 가미되었지만 보는 내내 진심으로 몰입했습니다. 영상이 아름답습니다. ,10
"여자라면 한번쯤 품어봤을 판타지를 충족하기 위한 목적만을 위해 만들어진 영화. 감동도 스토리도 개연성도 재미도 하나도 없고, 좋았던 감상포인트도 없는데 꼭 선택하라 해서 억지로 OST 누름. 맨땅에 돈 꼴아박는게 딱 이 영화를 두고 만들어진 표현 아닌가 싶음 ",1
,10
어느정도 예상되는영화였지만뭔가 묘하게 빠져들어가는매력 ,10
엘사랑 이두나 같이 노래할 때 눈물 찔끔남ㅜㅜ 정말 감동적 3차 뛰었고 dvd도 구매할 예정입니다 엘사 안나 사랑해ㅠㅠ ,10
연기가 묵직합니다. 한석규가 3초 정도 넘버3가 되어 한마디 남깁니다 ,7
,10
안봤지만 믿고 거르겠습니다. ,1
진주만을 보고 와라~! 엔딩까지 감동이다 ,9
제가 음악 영화 정말 좋아하거든ㅇ! ,1
대사 적은 권상우가 신의 한수라 하시는 분에게 동감에 또 동감주연만 바뀌었어도 이것보단 나은 관객 몰이는 되었을 듯그냥 대사없는 다큐멘터리에나 적합할 주연 인 듯 ,1
2019년에 영화관 딱 두번 감. 엔드게임이랑 포드 v 페라리 보러.이 두 영화가 한국영화랑 같은 값으로 볼수 있다는 사실이 놀랍다. ,10
ㅈㄴ 재밌게 봤는데 왜 평점을 안 줬었지.. ,8
소장하고픈 영화입니다.제라드버틀러 주연 영화 보고 싶게 만드는~폴른 시리즈 다음 탄 기대합니다 ,10
랍스터 샥스핀 케비어 꽃등심 모아다 쉰김치랑 된장 팍팍넣고 부대찌개 끓인 영화 ,1
우주선 승무원들이 커플 다섯? 아내가 위험하다고 2천명이 넘는 식민 개척자들을 위험에 빠뜨리는 인간이 승무원? 엔지니어 행성을 탐사해야할 납득가능한 개연성이 전혀 없고 고작 극저온수면 하다 죽기 싫어서엔지니어 행성을 탐사하면서 아무도 미지의 미생물에 대한 경계를 하지 않고 맨몸에 총만 들고 나대니 결국 자멸하는 것이 정해진 수순이지 공항만 가도 하는 검역을 외계 행성을 가면서 안하는 똥배짱이 납득이 불가능하다 ,1
존나 최민식 연애시뮬레이터;; ,9
감동.감동.감동.김동 ,10
근래 5년간 본 영화들 중 탑 3에 꼽을 정도로 좋았다. 흑백 피부색을 초월하는 버디무비 + 미국 동부에서 출발해 중부와 남부를 아우르는 로드무비 형식을 바탕으로 양쪽 세계에 낀 예민한 흑인 천재와 거친 세상에 있는 백인 이민자가 묘하게 앙상블을 이룬다. 비고 모텐슨의 코믹 연기는 <반지의 제왕> 캐릭터를 잊게 만들 정도로 완벽하다. 이런 영화를 만든 감독과 배우들에게 찬사를 보낸다. ,10
결말도 완전 이상하고 자동차 좋아하시는 분들이 아니면 보기 힘드실것 같아요ㅡ.ㅡ ,2
가슴 뭉클한 영화였어요. 재미도 있고 연기도 최고였어요. ,10
말레피센트 1도보고2도 봤는데 안젤리나 졸리에 비주얼에 푹빠져서보는듯 진짜 너무 이쁨.2도 볼만하고 동화 같음 . ,10
너무 감동적인 두 분의 연기력!!꼭 보세요~진짜 꼭 ,10
내용은 허술하고 연출도 별로지만 지루하진 않고 생각을 고취시키는 영화.폭력으로 공부를 조장하는 초반부는 현대사회와 맞지않으나 후반부의 정당방위와 성악설만큼은 지금 사회의 문제를 풍자하는 점에서 마음에 들었다. ,6
해운대에 백두산을 덮은느낌? ,1
배우들 연기가 인상깊은 영화였습니다. 별개로 스토리라인이나 연출이 너무 식상해서 별점은 낮게 드립니다. 영화관에서 볼만한 영화는 아니네요. ,2
도저히 이세상에 있는 단어로 이 기분을 표현할수 있을까 클레멘타인을 보고 내 인생이 바뀌었습니다. 오늘 당장 퇴사하고 집에서 가족이랑 클레멘타인을 보는 시간을 늘릴려고 합니다. 너무나 행복합니다... ,10
최고 백두산 안보고 미드웨이 보길 잘했다:) ,10
이 영화를 극장에서 볼수 있었다는것에감사함을 느끼며 단순한 감동이 아닌우리의 현실이 녹아든 영화였으며현실 서글픔 > 즐거운 희망 > 현실의 순응순응의 결과보다 두 주인공의 이루고자 했던열망과 실재보다 더 실재같았던 연기들이이 영화를 보다 아름답게 만들었다 ,10
연기는 물론이고 모든것이 괜찮았던 영화.보고 나면 괜히 하늘을 한 번 보게 되던! ,10
원작이 있는 영화를 원작을 잘살려도 본전인데... 원작을 뛰어넘는 내부자들급은 아니지만 디테일은 살리기를 바랬는데... 대사하나하나가 성의가 없이 내뱄는다... ,4
"이병헌 하정우 연기 참 잘함이병헌은 후 ㄷ ㄷ 영화를 정치랑 관련해서 평점 테러하는 인간들 수준이 저질이지 영화는 영화만으로 재밌었고  우리나라에서도 이런 높은 수준의 재난영화를 만들수 있다는거에  놀랐음.하지만, 마지막 엔딩은 조금 개연성이 부족했음.무슨일이 일어나는지 아무것도 몰랐던 국민들이 박수치는건 좀 억지.. 그 부분에서 좀 의아했음.영화 잘 만들었고 연기자들 연기도 좋았고 극장가서 돈 아깝단 생각없이 볼만한 영화. ",10
기대 일도 안했는데 평양냉면 마냥 그냥 어느새 젖어드는 영화 ,8
평점 왜이리 높은겨?? ,1
역시나 감동적인 명작 미국 애니메이션 강력 추천 합니다!! ,10
역시 남북공조하는 영화는 믿고 걸러야된다.. 왜 종북좌빨주사파 정권이 나올때마다 이런 영화만 찍어대냐?.. 문화계도 좌파가 점령하다니 최악이다.. 왜 남산의부장들은 잘될거라고 생각함??? 이명박 까는 영화도 나왔으니까 노짱 슨상님 까는 영화도 만들어주라 제발ㅎㅎ 음 그럼 큰일나려나??ㅋㅋㅋ ,1
최고최고  꼭 보세요 정말하여간 일본 ㅋ;;;; 노답 ,10
또 한석규가 왕이야? 또 최민식 주연이야? 배우가 이렇게밖에 없나?하고봤는데 보다보니... 최민식만 할수있는거였네.... 한석규밖에 없었네... 했습니다. ,8
정말 재미없음 쓸데없는 개그나 치고 있고 긴장감 1도 없고 이런 배우들 데리고 돈아까운 영화 ,2
해운대 백두산 버전 ,1
연기는 물론이고 스토리도 정말 좋았어요! ,10
결말이 정치적인 편향이 있음. 다소 불편할 수 있음. ,2
그냥 다른 영화 보시길...제목에 크리스마스 들어가서 본 영화 ,4
"전형적인 반미 친북 좌파 성향 쓰레기 3류 영화입니다. 이정도의 자본과 배우들로 이 따위 영화 밖에 만들수 없는 국내 영화 산업도 이제 끝났네요. ㅋㅋㅋ 미국 애니메이션 ""겨울왕국2"" 가 왜 1300만명 이나 넘게 보는지 아직도 깨닫는게 없는건가요? 이 따위 영화 밖에 못만들면서 무슨 스크린 독점 운운 하면서 매우 잘 만든 외국 영화, 외국 애니메이션을 디스나 하고 유치한 때쓰기 발언들이나 하고 있습니까? ㅋㅋㅋ 이런 한심한 짓을 하기전에 외국 영화나 외국 애니메이션을 평가와 실력으로 뛰어넘을 생각부터나 하세요. ㅋㅋㅋ ",1
감동 그 자체입니다. 보고 나오는 내내 먹먹함이 가시질 않네요. ,10
"연기는 볼게 없고 연출은 좀 뻔하고 스토리는 너무 중구난방 다루다보니 어수선하다고 느낌 위주다.  cg도 진주만(19년전 영화)이랑 비슷한 느낌. 하지만 웅장한 비행사운드와 가상이 아닌 실제있었던일, 미국과 일본에 작은 생각과 인권의 차이가 전쟁에 승패를 거든것만 같았음 ",8
독일여자의 진정성있는 사과가 인상적이었음. 본인의 잘못이 아니지만 선조의 잘못을 후세에도 계속 속죄하는 마음 ... 우리나라 옆쪽 나라는 언제쯤 뮈우칠까요 ,10
캣츠는 역시 뮤지컬.. ,2
정말 최고의 영화!!열번은 더보고싶은돈이 아깝지않다!! ,10
난 이 영화 재밌다는 사람들이 너무 너무 부럽다.다른 어떤 영화를 봐도 더더더더 재밌고 새롭게 느끼겠지... ,1
평점이 너무 높아 낮추러 왔습니다. ,1
전투신  단연 최고였어요    ♡♡ ,10
,10
이건 좌파들이 만든 영화인가보네~우리나라에 주적은 북한이고 미국이 최우방인데~~어쨰 거꾸로 만들었네요~최고급 스타 배우들로 3류 영화수준으로 만들고 홍보만 요란하게하고~~완젼 비츄네요~~~~주위 사람들에게 절대 보지말라고 권하는중~~~~ ,1
이병헌 연기에 10점드립니다 ,10
쓰레기 삽똥 영화입니다 절대보지마세요....제발....이런게 흥하면 앞으로 똥영화가 쏟아질까봐 걱정이 됩니다 ,1
영상 퀄리티 장난아님...꼬마덕분에 다시봤는데두번 봐도 재밌다 ,10
분명 재미는 있는데 무슨내용이죠..? ,6
영화 볼만하구만 평점 왜저럼 영화 보긴본거?잼있으니까 보세요 오히려 더 현실적이고 배우들 연기좋아요 ,8
한사람 한사람의 인생이 특별하게 다가오는 이유 ,8
일본 개발리는거 개꿀잼.한편으로 일본이 그 시대 태평양전쟁을 할 수 있는막강한 군사력을 한편으로 부럽기도 해서 씁쓸하다. ,10
"감동적인 스토리와 배우들의 명연기로 보는 내내 즐거웠습니다. 진짜 한석규, 최민식 연기에 소름~!말 한마디에 눈물이 주룩ㅠㅠㅠㅠ 감사합니다. 좋은영화 좋은연기 보여주셔서~!♡♡♡ ",10
테이블에 박힌 진짜칼주인공에게 박히지 않은 가짜칼 ,10
,10
,10
명 배우들 가지고 영화를 이따구로 만드나 진짜 돈 아깝네 보는 내내 너무 재미없어서 극장 나오고 싶을 정도 ,1
정말 시간 잘 안가는영화... ,1
백두산 내리고 천문 틀어라! 민식이형 석규형 구할아버지가 다찍었다이씨조선은 그래도 세종 때문에깔수가없다! 정말 대단한분이시다 ,10
재밌게봤어요 제목때문에 볼까말까 망설였지만 전 재밌었네요 네이버 평점은 의미없는거 같아요 보는 사람마다 감상 포인트는 다르니까요 ,10
오랫동안 기억에 남을 최고의 영화 ,10
너무 안타까운 비극입니다. 영화 보고 나와서도 참....여운이 남네요. 너무 안타까워요...ㅠㅠ ,10
끝이 허무하고 뭔 내용인지 모르겠어요 배우들 연기 잘해서 점수 줍니다 ,2
돈내고볼만한건안됨 비추천 ,4
역시 믿고 보는 두 배우님♡꼭 입소문으로 오래오래 흥행했으면 좋겠습니당♡새해부터 좋은 영화봐서 기분이 좋네요♡새해 복 많이 받으세용♡ ,10
다들 보세요ㅠ  최고입니다 ,10
수지랑 하정우 로맨스 없어서 다행.. ,4
다른 사람이었으면 신파로 채웠을 이 영화를 허진호는 사랑으로 채웠다. ,10
왜 이렇게 일본을 미화시키는거같지? 보는내내 불편함 역사적 사실을 어느정도 익히고 가면 일본 미화시키는게 눈에보임. ,6
메마른 사막을 거닐 듯 ,8
,1
"사랑을 붙잡는걸까, 추억을 붙잡는걸까 ",10
볼만하던데... 백두산보다는..  재밋었음 ,10
재밌게 보았습니다. 감동적인 장면도 많았구요. 배우들 연기 보는 맛도 좋습니다. ,10
평점 너무 낮은거 아닌가? 오락 영화로서 부족함이 1도 없는데 아니 최고수준인 영화 ,9
평점 너무 낮은거 아닌가? 오락 영화로서 부족함이 1도 없는데 아니 최고수준인 영화 ,9
눈으로 대화하는 두배우ㅜㅜ ,10
이런게 1위라니 이해가 안되네 ,2
너무 너무 잼있어요♡역시 안젤리나졸리 언니♡최고♡♡연기대박!!! ,10
,1
핵쓰레기는 이런걸 두고 하는 말인가? ,1
간만에 웰메이드 영화 제대로 봐서 매우 만족스럽네요 ,9
"이거 핵 띵작인데 배우 연기도 미쳤고 연출도 좋음 좋은 감독이신데 예능 이미지 때문에 저평가돼있음, 영화계 윤종신 같은 ",10
내가 1점준 이유는 0점이 없기 때문이다 ,1
"영화 리뷰 유튜버들도 괜찮다고 해서 믿고 봤는데 .. 그 유튜버들 돈받고 리뷰한거같더라구요,,, 결말도 완전 이상하고 사이다 장면이 없어요 ㅜ ",1
이렇게 재미있는 영화가 왜 못 떴지?  남녀노소 구분 없이 재미있음!! 첨부터 끝까지 긴장감도 있고 스토리도 좋고. 애들 보기도 좋고 어른도 잼있음 ,10
아 사랑니뽑아서 통증을 잊으려고 본 영화가재미없어서 아픈것에 더 몰입이 됐네짜증납니다 ,2
총 싸움 좋아하는 사람은 재미있게 볼 수 있는 영화.. ,6
중간중간 코믹한 부분도 있고 지루하지 않게 잘 봤습니다 다만 아쉬웠던 점은 초반에 폭발일어날 때 차타고 가는데 계속 부딪히고 그러는데 차만 멀쩡해서 자동차 광고 보는 것 같았습니다...그 것 말고는 좋았습니다 특히 배우들의 연기력이 최고였어요~!! ,8
"괜찮은 화면 때깔, 절제된 이야기 톤이 좋다. 다만 더 강력했음 하는 전투 사운드의 볼륨, 구심점이 흐릿하게 나열된 시퀀스 배치는 아쉽다. ",7
오리머리 발견한 여중생 누군가요....귀여워...이뻐... ,10
겨울왕국2 내용은 어른이 봐도 유치하지않고 재밌음 엘사 얼기전에 혼자 노래부르는게 하이라이트 ,10
평점 처음 남기는데 영화보고 이건 아니다 싶어서 글 남김. 요구하는 컨셉이 도대체 뭔지. 무슨생각으로 제작된 영화인지 스토리도 엉망이고 마동석캐릭터 질림. 억지웃음 끌어내려는 대사들 유치하기 짝이 없음. 졸다가 영화본거 진짜 오랜만임. 시작부터 끝까지 스토리가 뒤죽박죽 엉망 그자체. 명절에 집에서도 안볼 영화임.;;차라리 100번본 나홀로 집에를 101번 보는게 낫겠음. 처음 만든 영화도 아니고 .. 보면서 어이없는 실소뿐. 간만에 OOO 영화 봄. 멀쩡한 배우들만 망침. 지극적 내생각 ;;; ,1
너무 급폭기 대대에만 집중되어서 아쉬웠음 급폭기가 성공한건 진짜 극악의 생존률을 보였던 뇌격기대대인데 ,9
번역이 너무 별로여서 스토리 이해가 어려웠음... into the unknownn부를 때 가사랑 그 노래 부르고난 직후랑 갑자기 엘사의 태도가 바뀌는 거 하며...그래도 올라프는 귀여웠다. ,10
개봉 13일만에 vod나오는 영화는 생전 처음본다 ,1
노예제도를 만든 세종은 과연 성군인가? ,1
막장이 될 수있는 스토리인데 탄탄한 전개와 연기로 새롭게 탄생시킨듯연애편지를 계속 매일 썼다는것이 반전을 이해할 수 있는 요소 ,8
보다가 졸았다 기대이하 ,7
"한석규 , 최민식 연기 대박입니다 ",10
10분보고 스토리 진행을 예상했고 리준평 가족사듣고 결말을 알았다 ,1
개꿀잼인데 처음부터 끝까지 지루한 장면이 없고 갠적으로 진주만보다 재밌게봄 전쟁영화 좋아하면 개강추 ,10
관객수가 왜 이런가요? 많이 봐주세요~~ ,10
영화 보내 내내 한숨만 쉼 ,1
와...레전드다 진짜 최고의 영화 ,10
졸리가 다한영화.. 머리푼거 대박이였고 오로라는 키워준사람 안믿고 발암해서 중간에 짜증난거 빼곤 괜찮았다 다들 요정죽은거 얘기하는데 파란 요정이 드레스색 바꿔준거보니까 다시살아남여 ,8
,10
문소리감독의 다음 영화가 기대되는 영화 ,10
역시노래죽인다..10자너무많은데? ,10
평론가점수가 짠이유가 있음  솔직한평 초반부일본공습해올때 cg멋지고 기대했는데 중후반부 지루한감이 있음 엔딩도 허무함 암튼 스토리별로임 예전 진주만이 훨 재밌었음 일본 미화시키는쓰레기영화임 나알바아님 ,4
결말 아쉬웠지만 개인적으로 못 볼 정도 아니었고 긴장감있었음. 근데 아직 좀 의문이 남는 장면이 있긴 하지만 인생에 대한 교훈도 다시 얻은듯. ,8
와.. 캣츠 물러가라 물러가라 ,2
공포물 매니아인데 괜찮습니다 그리고 이 진상남편놈때문에 고답백만개 장면이 일부 있으니 부부간에 불화가 있다면 같이 보지 마세요 ㅋㅋㅋㅋ ,10
고딩이 죽였다. 사채업자가 협박했다 끝. ,7
한국영화 수준을 죽였다 ,1
에허~영화 참~쯧쯧  ㅋㅋㅋㄱ ,4
하정우의 연기가 좋았다 그것 말곤 없는것 같음 ,6
배우들 연기는 좋았으나 스토리라인이 너무 단조로움 보는 중간에 언제 끝나는지 시간을 계속 보게 되었네요 ,4
내가 이상한건가.. 개노잼인데 ,1
,10
감독 쓰레기새끼 평생 고통스럽게 살다 죽기를 ,1
재밋어용 ,10
주제는 성의쾌락을권하는게아니라 자신의행동에 책임을져야한다는 것같은데 왜 이렇게 평점이 낮지 나는 이영화를 보고 나의행동에 책임을 저야 겠다는 점을 생각하게되었다 무슨행동을 하든 간에 그리고 남여 상관없이 소중하고 서로 행동에 책임을져야 한다고 느끼게 해준영화이다 ,10
쿠키영상 쀼띠빵띠 ㅋㅋㅋ ,10
"""20세기 영화의 기적!"" ",10
오 대통령이 북한 찹찹해주니까 영화랑 드라마도 계속 이런거만 나오네 ㅋㅋㅋ ,1
내가 진짜로 이런식으로 억지로 끄집어내서 식상한 스토리 어정쩡한 연출 난 이런영화들이 정말로 싫다. ,1
"두배우의 연기와 조엿들의 감초연기도 좋았다, 근데 이걸 2시간 넘게보는건 좀 지루한듯.런닝타임을 좀 줄였으면 좋을듯.긴장감 부족 ",8
너무 슬픈 띵작 ㅠㅠ 엄청 울었어요 ,10
허준호 김태우도 짱누구하나 빠지지않고 정말 쟁쟁하네요 ,10
그냥 어린이용.이 영화를 보시고 희생한 700만 관객자분들께 심심한 조의를 표합니다. ,1
잊혀진 역사를 되돌아 보는 계기 ,8
타란티노가 내 취향인지는 모르겠으나 허를 찌르는 전개로 보고나면 중박이상 재미있습니다 배우들 라인업보면 연기력은 다들 장인급인건 말안해도 아시쥬 ,10
이런 멋진 영화를 이제서야 보다니~진짜 최고에요. 안보면 후회합니다. ,10
난 이제 전우치 리뷰들을 보고 네이버 평점 안 믿기로 했다 이 영화도 평점은 안 좋지만 나는 재밌게만 봤다구 ,8
"배우들 연기는 그렇다 치더라도 연출, 스토리 등 많이 엉성함 ",4
좌파페미코인이 영화산업을 말아먹은 한 해의 대미를 장식한 영화. 이 영화가 좌파코인인지는 모르지만 국뽕에 감성팔이 섞어찌개한것은 맞다. 단지 눈물이 안난다는것이 안습 ,3
 재미있게 잘  보았네요  수작임 ,10
정말 화끈했던 만큼 마지막에 너무 아리다.. ㅠㅇㅠ ,8
고증이 부족하지만 킬링타임용으로 볼만하다. 특히 원맨아미 스타일 총싸움 좋아하는 분들께  추천 ,8
