text,star
영화관에서 봤으면 큰일날뻔 했네... ,1
난 그럼에도 불구하고 다시 만나지 못할것같다. 잘지내 진심으로 사랑했다. ,10
,9
모르던 역사를 알게 해주어서 감사합니다. ,9
최고의 명작우리나라의 위대한 세종대왕 임금님과 최고의 발명가 장영실 그들의 참된 충심과 우정이 너무나 아름답고 뜻깊은 업적을 이루어내 눈물이 났어요~ ,10
,10
이렇게 좋은 배우들 데려다가 이게 뭐지ㅡㅜㅠㅡ진짜 ,4
백두산보다 백배는 나아 ,7
진정한 상남자 영화. 연걸형님의 멋짐 폭발에. 종려시 리즈시절 미모까지. ,10
석규형과 민식이형은 역시...대왕님 감사합니다 ,9
너무 기대를 많이 한 것도 있고.. 제가 감성이 매말랐나봐요.. 무슨 말을 하고 싶은건지 어디가 포인트인지 저는 잘 모르겠더라구요. 친구는 되게 감동적이었다고 하는데.. 취향이 확 나뉘어지나봐요. ,2
"여성이 육아로 인해 격어나가야 하는 어려움과 경력단절로 인한  노동의  단절, 자아성취의 단절 등등 있으나  사회적으로 이것을 문제화 하려는 시도보다는  개인  혹은 가정  안에서만  해결 하려는 스토리여서  답답증을 느끼기는 마잔가지였음.여성이 한 인간으로 성장하는데 임신과 출산이 고통만 있는  것은 분명히 아니다. 성장과 희열도 있고 그로 인해 우리 사회가 이로민한 단절을 보상해나갈 노동법의 변화가 절실 하다. ",6
"연출, 연기, 스토리 어떤 것도 빠지지않는 영화입니다. 중간중간 유머도 있고 참 재밌게 봤습니다. 두 배우 정말 연기 최고였습니다. ",10
"보고나면 가슴이 너무 뭉클해서 자꾸 보게된다. 보고나면 그게 언제든, 누구든 자신의 삶을 주체적으로 살 수 있다는 용기를 가지게 만드는 영화다. ",10
,10
잠수교 홍수쓰나미 어떻게 살아남음 ,6
"뮤지컬을 안봐서 그런건지 아님 내 개인 취향이 갈등없는 옴니버스 구조를 더 좋아하는 쪽이어서 그런건진 몰라도 전체적으론 괜찮게 봤음.별로였던 점은 첫부분에 cg에 적응하는데 좀 걸렸다는거랑 바퀴벌레가 너무 디테일했다는거, 그리고 '그 콧물'(보면서 여주가 콧물흐른 상대배우 얼굴보면서 애써 감정잡으면서 연기했을 생각하니까 몰입이 좀 안됐던건 덤ㅋㅋㅋ) ",7
왜 아직 148만명밖에 안봤어요ㅠㅠㅠ 왜ㅠㅠㅠ 5000만 봐야하는데ㅠㅠㅠ ,10
연기쩌네요 ㅋㅋ나온 배우들 모두 연기 미친든 다아는내용이지만 연기몰입감으로 감동이네요 ,8
,10
두분의 얼굴만 봐도 눈물이 줄줄 났어요 장영실의 충심과 세종의 장영실을 아끼는 마음.. 최고였습니다 ,10
꽤 잘 만듬~~~^^ 이병헌 연기가 좋고 씨쥐가 생각보다 오짐 ㅎㅎ ,10
실화를 바탕으로한 미드웨이 진수만이후 이들이 지켜야했던곳 미드웨이를 일본군이 침략해온다는 정보를 듣게되면서 이들이 약했지만 최선을 다하고 희생해서 지켜낸다. 전쟁이 넘 리얼해서 가슴아팠다. 절대 일어나서는 안되는 이야기다.  암호에대해 생각해본다. 전쟁신들을 잘 표현했고 대극장에서 보기를 추천한다. ,10
연기력은 뭐 나무랄때 없고....중간중간 너무 루즈해서 잠깐 졸음이 올순있어요 참고 일어나믄 또 볼만한 장면 나오고 또 졸고 .. ,6
내용은 평잼에 부모님이나 데이트용으로 적절한 수준이지만 한석규와 최민식의 연기가 멱살붙잡고 끌고가는 영화입니다 ㅠㅠ 장영실과 세종의 러브 아니 우정 이야기가 너무 절절하고 안타깝네요...ㅜㅜㅜㅜ ,8
"뮤지컬 캣츠에 비해 스토리도 있고 조금 더 자연스러운 전개를 만들기 위해 희생한 부분이 있는 건 어쩔 수 없다고 봄, 하지만 충분히 볼 가치가 있고 옛날 뮤지컬 영화인 사운드 오브 뮤직 같다고 생각하면 될 거라고 봄. 그런 류의 영화를 좋아한다면 보면서 감동 포인트도 있을 것이고, 그런 류의 영화를 좋아하지 않는다면 그저 당신에겐 수면제가 될 것임 ",10
,10
돈과 시간이 아깝습니다. ,1
미드웨이가 훨씬나은듯요  백두산 핵노잼 ,1
미국 파일럿 대단하다~ 너무 재미있게 보았습니다 ,10
,10
한석규...정말 연기력 믿고 빠져들게하는군 ,10
지금까지 본 전투 영화중 제일 재밌었음. 전쟁시 전투라는 게 이런거구나 하고 리얼하게 보여준듯. 벤 애플릭 주연의 영화 진주만보다 더 리얼하고 스케일이 컸다고 느낌. ,10
인간에게 신이 될 것을 요구하는 세상. 그 세상 속에서 살아낸 두 인간. ,8
개연성도 없고.. 스토리 엉망에 의문점 투성이임아니 그렇게 건물이 다 무너지고 했는데 청와대는 왜 겁나 멀쩡하냐?? 그리고 갑자기 버스는 어디서 가져와서 가게에 박은거고 갑자기 또 택시는 어디서 얻어 탄거야 그리고 감동 요소도 적당히 넣어야지 때려 박는다고 그게 감동이냐..?? 진짜 배우가 아깝다 ,1
최고입니다 정말.. 지루하다는 분들 있는데 저는 전혀 지루함 못 느끼고 봤어요. 고민하시는 분들 꼭 영화관 가서 보시길 추천해요 ,10
시간낭비 돈 낭비 저 영화 좋아하는데 생각하면 억울하고 영화라고 다 볼게 아니구나재미없어요 ,1
신분  상승의  가장 쉬운 방법이 결혼? 이 구도를 조금은 깨는  스토리였나 했는데 역시 였음.  여성이어도 지도력을 갖는게  어려운 현실도  잘  보여주고 있어서  성평등한 사회는 여성 스스로의 자각없이  역사를 바꿀수없음도 보여주는 영화 ,8
토하는 연기 너무잘함 내가다울렁거려.. ,10
"ㅠㅠ...ㅜㅜ,,, ",1
마지막에 진짜 슬프네여... ,6
그냥 막 만든 단막극 같네요빨리 만든게 티가 납니다 내용 연출 다 별로임그래픽도 그냥 새로움이 1도 없네요중간에도 갑자기 연결되지도 고등학교 영화 연출 수준이었음덱스터라 기대했는데 실망이 100프로 입니다 ,1
,10
,10
80년대생 꿀빨러들.. ,1
보는동안 여자친구가 자꾸 만져서 너무 재밌게 봤습니다. ,10
엄마랑 같이 보았어요~엄마는 즐겁게 잘 보았다고 만족하셨습니다^^저도 액션류를 좋아하는지라 재미있게 감상하였어요 ,10
,10
"우리가 가야할 길은 명확하다!부국강병, 과학기술의 발전, 언어 등 문화의 융성그리고 중국에 대한 사대주의 철폐이다. 그 과거에도 이런일이 있었다는 것을 생생하게 느낄수 있었고, 지금의 우리 상황이 너무 오버랩되었다. 어찌 수백년전과 하나도 달라진게 없을까?열연을 펼쳐준 배우들의 감정을 직접 느낄수 있었다.꼭 보아야하는 명작이다. ",10
진짜 세상이 미쳐가는거 같다. 나도 조커처럼 미치고 싶을 정도로.. ,10
재개봉이라니..꼭 봐야한다. 분명 감동받아 울테지만 뭔 상관인가. ,10
개인적으로 전쟁영화 별로 안좋아하는데도 정말 재밌고 긴장타면소 봣어요 ㅋㅋ 흥미진진 최고 ,9
진짜 꿀.잼!! 보장! ,10
스토리는 엉망.... 연기력은 최고 ,5
역사의 아픔에 중간에 펑펑 울었네요ㅠㅠ 여러나라 사람들이 봤음 좋겠어요 정말..!언어를 연구하고 모으고 알리는 것만으로도 정말 멋진일이라고 생각합니다.억압된 사회속에서도 민족의 언어를 지키기 위해 멋진일을 해준 분들께 너무 감사합니다. ,10
포카 칠줄 모르는 넘들이 댓글 달았나보네 쓰레기라고 하길래 봤더니 쓰레기라고 하는 놈들이 쓰레기였네 ,10
킬링타임으로 가볍게 괜찮아요 ,8
최고다 .. 진짜 웃기고 감동까지 .. ,10
안나와 엘사의 진정한 사랑이 느껴진다 ,10
개발암. 죽은 자들은 잊어버리고 ㅁㅊ 디즈니식 평화 외치기. ,1
이것저것 다 잡으려다 실패한 진주한 전쟁영화 ,6
"- 눈빛 하나로 모든 대사와 감정표현이 흘러넘치도록 담기는 연기는 처음입니다- 느와르적인 드라마틱한 전개가 아니라, 인간과 인간이 꿈을 공유하고 나누고 서로 보탬이 되어 처절하게 이루어나가는 이야기- 피흘리며 영토확장을 이룬 장군들만이 애국을 한게 아니라, 장영실의 보이지않는 하지만 무엇보다 고귀한 희생이 후세에 안겨준 선물의 무게와 의미를 깨닫게 해줌 ",8
수지는 여전하네 연기 못하는거 ,8
돈 아깝지 않네요. 때려부수는게 전부라는 평가가 있지만 전 그게 좋았습니다. 꼭 극장서 봐야할 영화입니다. 참고로 전 여자. ,10
오로라를 염소로 만들어야 될듯 ㅋㅋ 허접한 스토리 디즈니 영화 맞나 싶네 출연배우 그래픽영상이 너무 아깝다. ,2
어른들의 잘못으로 수많은 아이들이 너무 일찍 현실과 마주하고 어른이 되어야하는 삶이 맘 아프다.. ,10
아직 밝혀지지 않은 진실에 대해 ,8
"박진감 넘치는 영상미에 감동 받고, 실화를 바탕해서 더욱 크게 느껴진 영화. ",10
실화를 바탕으로 한 영화가 보여줄 수 있는 모든것을 보여주는 영화가 아닐까싶다.. ,10
꼭 보셈 대존잼 ,10
이 영화를 보고 암이 생겼습니다 ,1
후기가 별로여서 안 볼 생각이었는데 심심해서 보게 된 영화입니다. 기대를 안하고 봐서 그런지 저는 생각보다 재미있게 잘 봤습니다. CG가 너무 허접할가봐 걱정되었지만 생각과는 달리 퀄리티가 높았던거 같습니다. 이병헌배우의 연기는 역시 장난아니였고 깨알 웃음 포인트가 중간중간 있는데 피식피식 웃게 됩니다. 두시간 지루하지 않게 잘 봤습니다. 하정우의 꼬물이는 그래서 성별이 뭘까요..?? 아직두 모름(나만 모름?) 마지막으로 쁘띠쁘띠! ,8
,10
,8
일본 항모 박살낼때 그 통쾌함이란!!! ,8
"스릴을 즐기기엔 스릴이 부족하고, 스토리는 좀 기분 나쁜, 괜히 거창한 영화였다. ",6
,10
,10
우리나라도 625전쟁 영웅들 영화화했으면 좋겠음전쟁중에 북한군이랑 우정느끼는 OO은거말고 ,9
재미없음. 있는듯 마는듯 하는 결말에다가 어설프게 묻은 페미에다가 영상미 같은 말씀하십니다.. 어설픈 씨지죠. ,4
,10
문재앙과 대깨문들 자위용 영화. 친북친중좌빨들 지들은 태양광으로 해쳐먹고 있지. ,1
죽음 앞에 사람이 얼마나 이기적일 수 있는지 보여주는 영화. 지루한면이 있지만 서서히 긴장감을 높여주는 연출! ,9
"어색하고 뜬금없는 전개와 개그, 억지 감동, 개연성없고 납득되지 않는 캐릭터간의 연결고리, 가장 별로였던건 세종과 장영실 둘 사이의 어이없는 퀴어 코드. 좋은 배우들과 소재를 가지고 이런 작품을 만들 수 밖에 없었을까... ",4
포스터가 잘만들어진 영화..연기가 아까웠음 ,4
전투씬은 최곤데 인물들 캐릭터나 대사가 너무 진부해서 중간중간 하품 나오긴 한다 ,7
액션 좋아하지도 않은데 너무 재미있어요~ 시작부터 흥미진진!!! ,10
힐링하려고 봤다가 기분만 안 좋아진 영화..도대체 두 사람이 왜 사랑하는지 이해 안 되며 남자의 무례함에 매우 불편했던 영화 ,1
개돼지발 백두산 대폭발의 최대 희생자 ,8
아들은 재밌었다지만전 지루했어요노래도 1편이 더 나은듯 합니다 ,6
"노래는 좋았던 것 같다,, ",1
함께상영중인 한국작품들이 창피하다 ,10
,10
"그냥 최곤데, 왜 백두산 봄? 미드웨이가 여자인나도 멋지고 좋았음 ",10
너무 재미없었어요7살아들은 재밌다고 봤지만전 너무 지루해서 눈꺼풀이 무거웠네요 ,2
수동 차 사고싶어졌다.. ,10
갈수록 결말이 너무 오픈되어 긴장감이 다떨어지네요.뻔한 스토리 뻔한 결말...비추입니다. ,4
A Quiet Place ,6
북한은 우리겨레이고 감동깊게 보았습니다... ,8
이병헌의 연기가 가장 큰 비중을 차지하며 극의 전개를 이끌어가고 하정우는 이번 작품에서는 주조연 느낌을 처음 받을 정도로 신기했다. ㅎㅎ 뻔한 결말이 아쉽지만 스케일은 많이 발전한듯. ,6
등장인물이 매우많아서 헤깔리고. 다비슷하게생겨서 구분도안감. 또한 내용도 어려움 이해하기. 그리고 마지막에 등장인물 위인화한건 좀 역겹더라. 완전 미국식 국뽕 위인전 영화. 한국인이 굳이 봐야하는 이유는?? 그리고 내용도 역겨운게 주인공 비행기는 절대 안터짐. 무적임 ,1
아니길 바랬어.. 계속 맞다가 누가 갑자기 나타나서 장구를 칠거라는 예상을 안한건 아니었지만 그러지 않기를 보는 내내 기도하며 봤는데.. ,10
외로웠던 고흐.. 시대를 잘 못 만났던 것 같다그의 작품을 한점이라도 사주었더라면... ,10
?? 댄스파티요 ??오뚝이 준비 ~ 오뚝이 발싸 ~ 던질까 말까 던지까 마까 든질까 마까 든지까 마까던 던 든 든 던져 든져 ~ ,5
재밌고 유쾌했어요최근 어린이영화보다 많이 잤는데이건 재밌게봤어요 ,10
아니... 백두산에서 볼거리 영상미는 OO 좋다 치는데 배수지 대체왜나온거냐 그리고 남편이 적진 즉 북한에 있는대 긴박한 작전알려주는데(이장면은 택시통화장면임) 하정우는 또 아내바꾸라고 하고 OO고구마네 ㅋㅋㅋ 배수지 왜 주연는건지도 이해가 안가고 ,1
솔직히 개 노답영화박정민은 연기도 잘하고 참좋은데 시나리오를 못고르시는건가 ,2
기대 안하고 갔는데 재미있게 봤어요! 사실 추리물 치고 엄청난 대박 반전이 있는 것도 아닌데 뭔가 전개가 새롭고 호흡도 빠르고 캐릭터들이 다 살아있고 연기들도 잘해서 몰입된 것 같아요! 잘 봤습니다! ,10
별하나도 아까운 돈아까운영화내용도 없는ㅡㅡ왜봤을까 ㅡ.ㅡ ,2
이런 영화를 만들어주셔서 감사합니다. ,10
절대보지마라 개노잼 ㅅㅂ ,1
"재난영화로서의 스토리와 배우들의 연기가 좋았다. 특유의 뭉클함과 스릴감은 높진않았지만, 재미있게 볼만했고 코믹요소도 좋았다. ",9
,10
서로를 자신보다 더 소중히 한 우정이었다. ,10
스토리도 재밌어요.마지막 조금허무해요. ,8
시작과 끝이조금 모자라는느낌 ,8
제니퍼 로렌스 때문에 봤는데 크게 기대 안해서 나름 볼만했음 ㅋ ,8
"강동원이 이렇게 연기를 못했었나? 제가 보기에는 스토리 전개도 엉성하고 주조연 캐릭터를 잘 살려주지 못했고 뜬금 없는 신파에 권효주의 등장은 좀 어색 갑자기 전 쎄OO 보는 줄 알았음 동아리 친구들이 갑자기 뭉쳐서 음악하는 부분은 정말억지스럽고 어색했음 영화를 여러편 보는 느낌 연결이 안되는 억지 전개 그리고 강동원이 망가진 캐릭터를 잘 소화하지 못했다 생각 이건 내용도 억지스럽고 어디서 많이 본 듯한 내용 전개의 짜집기 수준 영화 전우치, 군도의 강동원은 어디로 간 것인가? 역시 강동원은 신파연기는 안되는 비쥬얼 배우 ",1
"억지감동, 뜬금없는 억지감동을위한 행동, 흐지부지핱 내용전현적인 한국 국뽕 억지감동 영화 다신 한국영화 안본다 ~ 했는데 배우에 속아 봐버렸네 ",2
,10
일본은 천황페하를 위해서 싸우고 미국은 나라와 가족을 위해 싸우고 나중에 티비로 봤으면 후회할 뻔 했을거 같다최고로 멋지고 감동적이다.미국의 승리가 없었다면 지금의 우리나라는 어떻게 되었을까 ~ ,10
2019년 최고의 대작 ,10
결말이 에스프레소 원샷한 것처럼 많이 씁쓸했지만 재미와 작품성을 이렇게까지 둘다 완벽하게 잡은 영화는 정말 오랜만에 본 것 같다.  (한우 짜파구리 먹고싶다...) ,9
재미없었어요차라리 천문 두번을 보는게 나아요 ,1
약간 지루한 부분도 있지만 진지한 연기에 감동했습니다. ,10
몰입도가 떨어진다..한석규의 연기는 엄청나나 웃음포인트가 어색하고 전체적으로 지루하다 평점을 보고 기대하면 실망할수있다 그리고 장영실 캐릭터가 너무 안어울린다.. ,2
이런영화 또 없나 이감성최고다 ,10
부디 진부하다 하지 말길... 96년작 ,8
조직은 한번 빠지면 이렇게 무서운 것 ,10
,8
가끔 씩 꺼내보고싶은 첫사랑같은 영화 ,9
재미없데서 기대안했는데잼났음 ,10
,10
그냥 예고편 분위기에 빠져서 본영화인데 킬링으로 굳 ,10
와 진짜 이걸 영화라고 만든건가? 차승원표 코믹연기라 믿고 봤는데 진짜 허접의 극치네. ,2
국뽕 건드리는 영화 넘 만족했음 ,9
최고의 영화다.. 초반 이해 안되도 제발 끝까지 보시길. ,10
영상미 액션 스토리 빵빵함. 다만 작가나 감독이 미필인게 확실함....대위가 대령한테 맘먹는것도 어이상실 껌씹고경례도ㅋㅋ그리고 대령의 평균 나이대와 하는일을 잘 모르는듯....ㅋㅋ 대령이 저정도면 진짜 특급전사임 ㅋㅋㅋ ,8
반전의 반전...최고다 ,8
볼만하네.. ,8
사실에 기반한 최고의 영화 추천합니다 ,10
연기력 끝내주네요오랜만에 의미있는 영화보고 울었어요ㅠ ,10
적적하니 좋네요.. 연기 일품입니다 ,10
"오즈 야스지로, 미조구치 겐지가 나올 필요도 없이 구로사와 아키라 한 명 만으로도 역대 동아시아 영화감독 올킬인듯. 왕가위, 장이모, 이안, 봉준호, 김기덕 대 합해도 영화사에 남긴 족적만 보면 아키라 한 명이랑 비슷비슷 할듯. ",10
"연출이일단되게좋았고,볼때 우울한편이었지만제모습을보는거같기도했고, 다음날 그다음날에계속 조커영화가 맴도네요. 전 여운이진합니다.. ",9
영화 평점이 너무 낮네요 ,10
꿀잼!!! 또 보고싶음!! ,10
,10
액션이 현실적이여서 좋았지만 스토리랑 결말이 너무 뻔해서 재미가 없었음 ,5
내 생애 최고영화 알렉산더 ,10
기대이하입니다 졸렸어요 ,4
"별을 보고 싶은 세종과 별을 보여 주고 싶은 영실, 허진호 감독만의 섬세한 연출로 탄생한 '그 순간' 만큼 우리 모두는 별을 보고 싶었고, 별을 보여주고 싶었다. ",8
오로라 개발암 ... ,4
샤이닝에 나왔던 꼬마 ''댄''이  성인이되어서 나오는데 스토리는 연결되는데완전히 다른 스타일의 영화같습니다.   상대적으로 현실감은 샤이닝이 더 있는거같네요.  닥터슬립은 판타지쪽인듯...  재미는 샤이닝보다 훨씬 재밌습니다. ,7
2019년은 보헤미안 랩소디로 시작해서 포드V페라리로 끝난다 ,10
"역시 믿고보는 이병헌, 하정우알고보는 마블리입니다 ㅎㅎㅎ우리 나라 재난 영화 중에서 가장 괜찮은 작품 같아요. 모성애가 아닌 부성애를 강조한 것도 나름 좋았습니다. 스토리가 조금 억지인듯하지만 재난영화 특성 상 어쩔 수 없겠쥬 ",9
,10
조 파스텔 홀트하우젠 여신급이구나 ,10
"간만에 좋은 영화, 여운이 남는 영화 보고갑니다. 감사합니다 ",10
고증을 충실히 따른 밀리터리영화입니다! ,9
오늘도 광고댓글에 낚였다. 개연성은 어디에? ,2
한석규의 세종대왕이라면 나라도 발벗고 나서서 충신이 되었을 것 같음.. ,10
저는 재밌었습니다만.. 재미있었어요 기대를 안하고 봐서 그런가 맘편히 봤습니다 ,10
배우들 다 매력터지고 킬링타임용으로도 너무 좋아여! ,10
왜 조커의 행동이 전혀 죄가 아닌것 같은 생각이 드는 걸까? ,10
"드라큘라, 오멘, 이블데드 등등을 오마주한 가운데 스님이 인상적임. 공포영화보다는 종교영화가 아닌가 싶기도. 엔딩이 약한게 아쉬움. ",10
엔지니어 연기가 너무 훌륭하고 킴 목소리 정말 예뻐요. ,10
후반부 연출적인 부분이 몰입에 방해가 조금 있었지만 재미있게 관람했습니다. ,8
오랜만에 볼만한 전잰영화였다 ,10
시나리오도 너무 대단하고 수지빼고 연기도 다들 멋졌는데???왜 다들 욕하는지 이해를못하겠다 ,10
생각보다 재밌네. 페이들의 전투신이 그나마 살렸다. ,8
,10
감동스러우면서 배우들의 연기가 대단했다.흥미로운 장면도 함께 있어서 재미있었다. ,6
중간중간 지루한 진주만보다 훨 낫다. 진주만 초반에 복습하고 넘어가니 더욱 배경의 시간대가 넓고 총정리하는 느낌 ㅋ 군더더기없고 태평양전쟁의 전반적인 분위기를 잘 담아낸 대작이고 명작이다. 영화관에서 보는 영화의 참맛을 알게해주는 돈이 아깝지 않은 영화다. ,10
나만 재밌었나 ㅋㅋㅋㅋ 난 하정우식 개그가 너무 잘맞아서 보는 내내 재밌었음 ,10
볼 때 마다 하이퍼리얼리즘에 감탄하고 갑니다ㅠㅠ 20대에 연출하신 거 맞습니까... ㄷ ㄷ ㄷ 사냥의 시간도 대박나세요! ,10
이병헌 무공수행중  대사가 없오 ,2
낙하 비행 진심 멋있네요 ,10
다시봐도 명작입니다. 꼭 보세요 ,10
와 이한마디로끝난다! ,10
,10
말이 필요없음 배우들 연기때문에 게이가 될 뻔했다 ,10
최근본 영화중 젤 재밌게봄 ,9
개쩐다. 죽인다. 이게 액션이지 ,10
예고편을 본 듯한 부족한 서사 ,6
역사의 무거움..위기의식의 중요성 ,10
한석규는 역시 멋있다 연기도 넘 깔끔하고 배우 연기가 아깝다보는 내내 오글거리고 브로맨스영화인 줄좋은소재 좋은 배우 아깝다 ,7
웃기려고 노력했고 액션하려 노력한것같은데 재미없음. 애쓴다는 느낌? 스토리 자체가 탄탄하지도 않고 흐지부지했음 기대안하고 봤는데도 볼만하지않음. 재미있다는 사람들은 아마 웃기려고 노력한부분을 재밌어 하는것 같음 똥싸다만 느낌의 결말... 아니다 똥다싸고 안닦고 나간 느낌의 결말이였음 배우들의 연기를 담아내지 못한것같음 억지로 눈물짜내는 것도..쫌..하...연기 다 좋은데 배우들 다 정말좋아하는 배우들인데 안타깝다..그냥 ,2
미장센이 다했다. 역시 장이머우 ,8
재밌고 감동포인트도 조금 있어서 좋은데욕이 정말 너무 많이 나와서 놀랐음 ^^..스토리면에서도 끝마무리가 살짝 안된기분..그래도 가볍게 보기엔 좋아요! ,7
오로라랑 왕자 쌍으로 대가리 꽃밭 ,4
엄청 재밌는영화라고 추천은 못하겠지만확실한건 엄청 좋은영화인건 분명하다. ,10
소피아 너무 좋앙..사랑혀.. ,10
극한직업같은 영화가 아니라 이런 영화가 1000만을 가야 된다 ^^ 미드웨이 해전이 아니었음 영원히 일본에게 고통받았을듯... ,10
"어벤져스랑 슈퍼맨이 싸우면 슈퍼맨이 이긴다. 다 이긴다. 무조건 이긴다. 슈퍼맨은 우주최강이다. 천상천하 유아독존. 그래서 저스티스리그는 망했다... 슈퍼맨만 있어도 되니까... 왜 모인건지 모르겠어서... 그냥 어벤져스가 모여서 흥행하니까 우리도 모이자 하고, 모일 필요가 없는데 모이기 위해서 모인거 밖에 안되니까... ",10
멧 딜론.  사랑을 위해서  모든 걸 버렸다 ,10
충분한 긴장감 재미를 준영화 ,10
,10
왜 선의라고 평가 하는지...선의에 앞서 오로지 순수하고 냉철한 이성을가진  마르타에게 전부인 유산을 남겨준 이유...그 마르타는 자신보다 더욱더 현명하게 유산을써줄수있을거라는 믿음때문에..선의가 바탕이 되어야겠지만 착해빠진 사람을 믿고 목을 그을수있었을까..? ,10
전쟁 영화에 남을 걸작을 박평식이는 4점 주었다 왜냐?? 내 생각에 튀어 보일라고 평식아 너 영화나 찍어봤냐?? 그만 튀어보일라 해라 평론가 중에 니가 낮은 점수주면 다 대박났어 평땡아 ,10
와.. 이건 그냥 뭐라 할말을 잃게 만드는 영화다. 정말 와닿는다.. 가장 가까이 있는건 보지도 못하면서 가장 멀리 있는것만 쫓아가는 우리 모습.. 그저 완벽한 영화 ,10
100점 만점에 10점 이지만 네이버의 마음은 10점까지인 모양다. 그저 전설앞에 선 한 미물에 불과한 제가 감히 점수 올립니다.(관객수가 4천명이 안되는데 평점은 20000명이 줬어 ㅋㅋㅋ) ,10
정석적인 전쟁영화 2d관에서 봤는데 기총소사가 오면 부르르 잼있는 킬링타임 ,8
"때로는 푹신하게, 때로는 저돌적으로, 결코 그들을 특이한 것처럼 보여주지 않는다. 그저 같이 있고 싶다는 순수한 이유 하나만을 중점으로 두기에 거슬리지 않는다 ",7
"실제사건을 모티브로 한 영화란 걸 알고 봐서 그런지 조금 더 영화에 몰입을 할 수 있었습니다.그렇지만, 사건보다는 인물들의 감정에 무게를 더 두고 있는 느낌..? 이 들었네요 ",9
