text,star
퍼포먼스가 쌓여 도파민 분비를 촉진시킨다 ,10
이병헌이 내부첩자였노...ㄷㄷㄷㄷ ,2
티비에서 볼때마다 빵빵터진다 ,10
영화의 장면장면이 정말 잘만들었더라 깨진유리를 통한 장면전환도 짜임세 있었고 마지막 레이싱을 위한 빌드업이 정말 깔끔했다 ,10
개인적으로 어두운 영화는 꺼려하지만  음악이 꽤 좋았다.연기도 어색하지 않고. 신인감독 작품이라던데 별로 의식되지 않음. 저예산 영화인건 맞는것 같고.. 우리나라에선 보기 힘든 영화인듯. ,7
김아중 노래 실력 대단하다! 다시 보고싶은 로코 ,10
영화 웬만해서는 안가리고 다 재밌게 보는 편인데 이영화는 진짜 아니다 ,1
,8
재밋엇슴 ,10
분위기 굿 역시 배우의 연기에 과몰입해야한다는 점은 조금 아쉬웠음조금더 디테일한 설정이나 장치 또는 존재감있는 캐릭터(예를 들면 조말생장군으로 나온 허준호씨?)가 있었으면 좋았을 듯(비단 이 영화 뿐만 아니라 요즘 개봉하는 모든 한국영화) ,8
아이들이 보기에는 지루해하네요. 겨울왕국을 생각하고 보면 안될듯 ,6
,10
지금까지 본 영화 중에 이렇게 시간 아까운 영화는 처음.. 나한테 똥을 선물해준거같음. ,2
이것도 아닌 저것도 아닌..  감동포인트를 모르겠는 영화 ,4
,10
,10
새해 첫 영화는 클레멘타인으로~ ,10
유일하게 재탕안한 극장판 ㅋㅋㅋ 짱구 극장판들 내용이 어른들이 봐도 괜찮은데.. 이건 그냥 어린이용 ㅋㅋ정말 아무내용이없다고 봐야함ㅋㅋ마지막 부분은 ㅋㅋ보는 내가 한심하게 느껴질정도 ㅋㅋㅋㅋ ,1
,10
"교육영화 보는줄 알았습니다. 공중전이 멋있는데 그걸 남발하다보니 점점 지루해지네요. 일본은 충성, 미국은 가족애 이런 관점도 이젠 너무 진부하지 않나요. ",1
재미있게 봤어요. 울림이 있네요 ,10
만감이 교차미드웨이 승리로 결국 미국이 원자탄을일본 히로시마. 나가사키 두군데 불바다만들어  일본이 항복하고 우리나라 독립하고 .... 부칸 그만빨고 친미 강화하자ㅠ ,10
눈물나네요..ㅠㅠ 각자 사람들이 다 다른삶을 살았고 강아지들도 똑같다는 생각이드네요 ,10
미국 수사물. 내용도 평범하고 연출도 평범해서 그냥 그랬다. 깔끔한게 장점이라면 장점. ,6
어휴.. 백두산을 못피했네 ,1
간만에 대작을 만나 기뻤습니다한.일전 축구 응원하는 기분으로 재밌게 봤습니다 ,10
역시 북한군 이였군요 ,10
애 평점 왜이리 높아요? 네이버 영화도 댓글 알바 있어요? ,2
기대안하고 가시면 볼만해요~ ,8
우리나라는 영화에 정치적 요소좀 그만 넣었으면 집중 싹 깨지고 의도가 보여서 역했음.. 하정우 이병헌 연기는 너무 아까울만큼 좋았음 특히 이병헌은 미친거 같다 ,1
기대 안하고 가시면 재밌는 영화~ ,8
수영은 좀 빼자;;;; ,1
솔직후기솔직히 잔잔한영화 가볍게 볼만했던영화지영화관용은 아닌듯ㅎ ,8
"1976 미드웨이판 보다 떨어지는 편집 부족 완성도, 뇌격기들의 비장한 희생으로 치뤄진 전쟁 비장미를 살리지못한 역사적 미국 승전해전. 아무리 뛰어난 CG영상도 극적구성과 효과적 편집이 부족하면 흐름을 바꾼 극적인 승전감동을 살리지못함. ",6
사극영화는 지루할거 같다는 선입견이 있어서 늘 화려한 전투신 나오는것만 봤었는데  이 영화를 보고 바로 달라졌습니다. 추천입니다 ,10
재밌게봤습니다! 바쁜엄마대신 아빠가 육아휴직내고 애들 돌본다고 페미영화라니 ㅋㅋㅋ얼마나 시대를 역행하는거냐 ㅋㅋㅋ 시대는 변하고 있단다 ^^ 육아는 공동책임임~ ,10
역시 존재감은 이병헌 ,9
다좋은데 결말이 왜이러냐.디즈니 답다고 해야돼나. CG는정말 극강의끝을 보여주네. 근데 이영화보고나면 없던인간혐오증 생길듯. ,8
수지..쓰나미 맞고도 떡지지않는 머리카락을가진 만삭임산부 역활이라니이병헌은 진짜 연기로는 흠잡을곳이 하나도없음 ,6
꼭보세요 재밋음 !!기대하지말고 가볍게^^ ,10
,10
존나 노잼일것 같네 14자 제길 ,1
진짜 웃겨요 남친이랑 계속 웃었네요 ,10
교회는 1도 모르는 무교지만 인간적으로 감동받은 영화 ,10
그냥 다큐멘터리! 스토리가 없는 지루한 총질만 난무!! ,1
19년 한해동안 본 영화 중 최고였다.감동과 재미가 있고 주연뿐만이 아닌 모든 배우들의 연기도 엄청난 영화였다. ,10
액션말고는..모두 그닥...스토리도 말도 안되고초반 자동차 추격씬에 알파로메오 차량은운전석 사이드 미러가 붙었다 떨어졌다시공을 왔다리 갔다리 한다 ,6
"꼭 보세요, 그의 예술과 순수함에 반하지 않을 수 없습니다 ",10
,10
,10
,10
1편보다는 영상도 좋고 스토리가 더 흥미진진하네요~~ ,8
연출도 좋고 역대급 영화라고 생각해요 ! 특히 리준평이 진짜진짜 감동적이였다죠 ... 물론 미국을 좀 비판하고 북한을 찬양하기도 하지만 전체적인 스토리는 좋았습니다 ㅎ ,10
영웅의 모험 12단계를 철저하게 지킨 작품. 보기쉽게 잘 짜여진 작품은 오랜만이다. ,10
저는 기대를 안하고 봐서~CG가 이정도로 높아진거에 점수를 많이 줬음스토리는 단순하지만 재난영화는 복잡한것도 별로임 배우들의 연기가 돋보였고 마오빠는 왜나온거임?그냥 그런 배우가 나오는게 더 나았을 듯 몰입감이 안들었음 ,5
옛날 영화들에 대한 패러디가 아재들의 향수를 자극합니다.개인적으로는 크리스토프의 OST가 맘에 듭니다.아저씨들 관점에서 볼 때~~ ,10
"말이 필요없음.. 그냥 무조껀 봐라.. 지금  시대에 필요한 리더의 모습... ""전하가 꿈꾸지 않으셨다면 제가 생각 이나 했겠습니까?""""야이 x새끼야"" ",10
진주만을 시작으로 미드워이까지 너무 많은걸 보여주려 했다. 산으로 가는 느낌이다. 탑건2가 기다려진다. 예전 진주만이 훨씬 재밌었다 ,5
메모리즈를 이렇게 망쳐놓냐. 제니퍼 허드슨이 너무 울면서 불러서 오히려 감정몰입이 안됨. 진짜 메모리즈 한곡만 남아도 괜찮다고 참으면서 봤는데 메모리즈 듣는 순간 차라리 앞에 노래들이 나았다 싶음. 정말 좋아하는 넘버였는데 에휴 ,1
이토록 절절한 멜로라니...선명하고 분명한 정통사극을 보았습니다! ,9
성당 음악이 아주 좋습니다. 수도자를 떠나서 인간본연의 감성을 느낄수있어서 좋았습니다. ,10
겨울왕국1보다 훨씬 재밌고 노래가 너무 좋아요.... ,10
홍번구와 함께 90년대 성룡표 할리우드 영화의 명작! ,10
이런영화 또 보고싶네여 ,10
역시 세종은 한석규..  뿌리깊은나무의 스핀오프를 보는듯.. ,10
완전기대하고봤으나처음엔 졸고 정신차려서 겨우 끝까지본..너무 기대했나드라마였으면 ...영화는 그냥 ,5
전쟁영화 안좋아하는데 시간가는줄 모르고 봤습니다. 적극 추천! 진주만에 대해서 다시 한번 궁금증을 낫게 했습니다. 파일럿분들 너무 대단하신것같아용! ,10
그냥 데스노트에 고스톱을 섞은 삼류 쓰래기영화이딴 영화나 쳐 나오니 발전이 없는거임아 시간 아까워Ps:그나마 좋은점을 꼽자면 화투패로 주민번호 만드는참신함 (말고는 없음) ,1
"개인적으론, 3편이 최고라 생각함 ",10
"재미있게 봤습니다. 이병헌,황정민의 연기는 정말 박수를 치고 싶어용 ~~! ",8
멀어지는데 가까워지는 아이러니 ,8
저체적으로 코믹해서 좋긴한데 내용이 좀 부족한 느낌? ,8
"계속 한석규 배우가 최민식 배우한테 눈맞추면서 ""영실이...영실이.."" 이러는데 딥키스 하는줄...너무 재미없어서 막판엔 `차라리 딥키스하고 게이물로 가자` 이런 생각함(묻고 더블로 가!)개연성 제로라서 연기는 넘사인데 내가 저 감정이 이해가 안감(연기 보니까 뭔가 너무 슬픈것 같긴한데..왜!? 왜요)그리고 세종은 갑자기 왜 세월을 혼자 얻어맞은 얼굴로 나오는걸까나 영화간 가서 잔적 거의 없는데 간만에 영화 중간에 졸았음명배우들 연기가 너무 아까울 정도로 졸작을 넘어 망작인듯 ",1
,10
아~  조조로 봤는데 아직도 여운이 남네요.연출 연기  다 완벽했습니다.주연  조연 할것 없이  소름돋는 연기들이었어요강추합니다 ,10
한국영화 수준 참 ㅋㅋㅋㅋ  내 얼굴이 다 화끈거리네 대한민국 관객수준에 딱 맞는 영화였다 어휴..해운대 이후 국적 바꿔버리고 싶은 충동은 또 오랜만이네 ,2
대한민국 국민이라면 감동받을 수 밖에 없는 영화. 정말 영화라는 단어의 의미를 재인식하게 되는 영화 그 자체. 눈빛만으로 관객의 몰입을 이끌어내는 연기까지 완벽했습니다 ,10
일단 10만달러...1억 좀 넘는 금액에 목숨을 건 사람들이 이렇게 많다는게 좀 과장. 100만 달러면 모를까 사람 목숨 값이 그리 싼가? ,4
전문직의 매력을 최대치로 끌어올린 영화. 이상하게 새해에 쌀쌀하고 낯선 선선함이 영화에서 느껴진다. 그니까 20년 1월에 다시 보기 고~ ,10
포드 회장님 뚱뚱... 돼지 ,10
거장의 일생을 엿볼 수 있었던 걸작입니다. 파바로티의 환상적인 목소리와 함께. ,10
,10
이런 영화가 상영관만 잔뜩 차지하다니...! ,1
무턱대고 까지말란 댓글에 1점. ,1
상영하는 내내 식은땀 흘려 죽는줄 알았습니다... 잔다고 ,1
신정때 백두산이랑 천문 연달아 보러 갔었는데 천문 진짜 장난아니었고 말로표현할수없음 이건 가서 꼭봐야함. ,10
,10
전달하려는 스토리가 명확하고 전투신도 화려함. ,10
,10
사실 평가하는건 사람마다 느낀게 다르고 생각도 달라서 재미없다 할수있고 재밌다 할수있겠지만 개인적으로 정말 시간가는줄 몰랐고 과하게 웃기려고 하는 부분부분이 많았지만 신경쓰일정도는 아니였다 그냥 끝나고 나오면서 재밌다 외치게 되는 영화였고 돈도 아깝지 않았다 배우들 연기도 매우 잘 봤고 현실적이지 못한부분이 있긴 했지만 영화는 영화일뿐 이다 보시려는 분들 그냥 재밌게 재밌게 보면 될거같아요 ,10
폰으로 찍은건지 뭔지 출연진도 2명바께아 안되는건 또 뭐고...폰으로 찍으셨나요..??하나도 무섭지도 않고 시작전 영상도 너무 길고 영화도 지루했네요 ,1
개노답 노잼영화억지감동 억지웃음 유도를 숨기려해도 여실히 드러남 ,1
가슴이 먹먹하다.. ,10
보다 잠깐 졸았는데 깨니까 영화 끝나있네요ㅡ.ㅡ 꿀잼은 거의 못봐서 모르겠고  꿀잠은 잤습니다. ,1
포드 v 페라리가 아니라 포드 v 켄마일즈네 ㅋㅋ 페라리는 싱겁게 끝났고 포드랑 싸우는게 더 많아 ㅋㅋㅋ 영화 자체는 재미있었다 ,10
있는건 하나도없고 과도한 남vs여 구도.. ,1
롯데시네마에서만 하는지 모르겠네...재밌는데 ,10
관객수가 적어서 너무 아쉬워요..많은분들이 이영화를 보고 깨닫는게 있으면 좋겠는데.. ,10
쪽바리 민주화 영화는 무적권 별5개! ,10
최고의 오락 영화.. 스케일 엄청나고 거대 로봇과 거대 괴수의 막고라를 잘 살려놧음.. 이런 영화 보고 내용이 어떠니 스토리가 어떠니 ㅆ소리 하는 애들 특 = 안경 멸치 찐임 ,10
재밌는데 충분히!!!! ,10
맘 편히 볼 수 있는 영화 재밌음 ,10
재밌음 ,9
믿고 보는 배우들의 조합이라 영화 나오기 전부터 기대를 하고 봤다 보고 나서는 이 배우들 조합으로 왜 이렇게 만들었을까라는 생각이 들었다 실망한 점은 말이 안되는 스토리와 이어지지 않는 부분이 있었기 때문에 돈을 주고 보기에는 아쉽고 나중에 타지에서 하면 1번 정도는 볼 영화 ,4
,10
영화가 너무 지루해요~~ ,2
진짜 재미있게 본 것 같아요!!ㅠㅠ ,10
마동석은 액션 영화가 잘 어울리지만 너무 액션 연기만 해서 연기가 비슷한 구석이 있는 것 같았는데 이번 영화에서 액션이 조오금 있었지만 재미적인 요소의 연기도 재밌었음 딱 내 코드 ㅋㅎ ,9
감독이 두명인게 에러인듯... 오합지졸임... 저런 배우를 데리고 이정도 밖에 못찍다니... 소재와 배우가 아깝네요.. 쩝~ ,1
"위대한 천재 과학자와, 그 능력을 알아보고 등용하고 백성을 위한 정치를 펼친 세종의 우정 이야기. 감명깊게 잘 보았습니다. 역사의 한 획을 그은 두 분의 이야기가 영화에 잘 표현되어 있어 감동적이고 재밌고 따뜻했습니다. ",10
"별로라는 댓글이 많아서 기대 안하고 봐서 그런지 재밌었음. 말이 안되는 요소는 많으나 연기가 좋고, 스케일이 커서 극장에서 볼만하다고 생각! ",8
"라스베거스로 상징되는 기회의땅 아메리칸드림. 차별, 좀도둑질, 폭력과 섹스, 마약이 넘쳐 흐르는 혼돈의 정글속에서 누가 기회를 얻고 권력을 누리는가 ",9
,10
악당이 너무 신박한 것 같으면서도 의외로 별 거 없어서? 기대치 만큼 재밌지는 않았던 것 같음 ,8
,10
개봉 첫날 봤는데 감상평을 이제 적는군요. 죄송합니다.몇몇이라도 돈을 아낄수 있었는데....돈 모아 뮤지컬로 보시기를 ,2
어디서 본거 같은 영화 그래서 익숙한 맛이 있다. ,8
진짜 너무 좋았던 영화.. 진짜로 눈물 쏟으면서 봤어요ㅠㅠ 최민식이랑 한석규의 케미는 정말 최고ㅠㅠ 여러분 이 영화 정말 강추요!ㅠ ,10
,10
백두산이아니라 뭐 탈취전임? ,1
킬링타임용 볼만함 나름 ,7
조정석이랑 윤아가 다했다 ,10
,10
초중반 부분은 지루하게 느낄 수도 있겠지만 이 영화가 실화를 기반으로 만들어진 영화라는것을 생각하면 그 지루함마저 감정이입 할 수 있다 ,8
"흑인이나 비만녀에 대한 차별이 만연한 세상에서 차별 폐지를 외치는 그들이 멋있네요 ㅎㅎ 하지만 아직까지 외모지상주의라 엠마가 너무이쁘고, 엠마만 생각납니다 ㅠ ",10
반전의 연속.. 스토리가 전혀 예측하지 못한 방향으로 흐름.. 반전포인트에서 나레이션으로 구구절절 설명해주는게 영화이해하기는 쉽긴 한데 뭔가 아쉽네요.그래도 주연배우들 연기덕분에 새벽에 완전 몰입하고 숨죽이고 봤습니다. 추천해요. ,8
진짜 인생영화입니다ㅠㅠㅠㅠ OST 너무좋고 진짜 배우분들 연기도 좋고 스토리도 좋고...두번...아니 세번보세오ㅠㅠㅠ ,10
마 내가 어제 임금이랑 술도먹고 사우나도 가고 그랬어 임마!임금 데려와!! ,1
솔직히 백두산보다 시동이재밋다 ,9
한석규 최민식의 열연에 막판에 눈물 찔끔ㅠㅠ 감동했어요 ,10
다들 재미없다는데 왜 7백만이나 봤지? ,6
노래만부르다 끝남 ,3
 뜡국 서남공정+서북공정 공작영화. 300 표절=양 수레 타고다니는 빡빡이 형.1.늑대가죽쓴 여자 화장을 서구적 느낌이 들게함 (이집트 파라오 짭퉁)2.백성 모양이 티베트 느낌.3.외국인 여자 이상한 화장+춤추면서 이상한 의식같은거함 ).천랑국 야만족 묘사는 요새 뜡국이 신나게 때려잡는 (티베트 + 위구르).즉 오랑캐는 나쁜놈들이고 미개하다 그러니  때려잡아 듕국식문명화 듕화사상 주입 +꽁싼당 일당독재 하자는 내용이 간접적으로 들어가있음. 심장은 말안들으면 장기 빼간다 ex 따룬궁 . ,2
고양이를 너무 잘 이해하고 표현한거같아요!! ,8
"오래전 기록물, 오래전 기억을 가진 분들을 찾는 진행에 보는 내내 같이 뛰어다니는 것처럼 흥미진진하게 감상했습니다. ",10
진짜조온나게재미없네 ,1
보러 왓더니 영호관에 다 내림 ㅜㅡㅜ... ,10
모두 지나가버린것들 남겨진거라곤 쇠약한 몸뚱아리뿐 ,10
큰 화면으로 전쟁 감상하려면 제격입니다. 스토리는 조금 정신없지만 롤러코스터 타듯이 전투 감상하려면 보고 오세용 ,9
,10
,8
남북 브로맨스도 괜찮앗고 코믹하기도 했는데...여친이랑 보면서 잼있게 봤는데...흠..이상한 종북 좌빨이니 북한이니 미군이니....이상한 이야기들 하시네북한 미화가 아니라 재난 때문에  남북의 사람이 만난게  ..왠 북한 미화 ㅡ.ㅡ너무 어이없어 글 남겨요!! ..쓰레기 정보남발.... 하지 마세요.. 범죄수준의댓글들이네.. ,8
외톨이가 있어야했는지 잘 모르겠고.. 나는 잘모르겠다 ,6
"본격 이병헌 하정우 전혜진 낭비영화.킬링타임용으로 보기도 아깝다 . 시간이 남아돌아서 버리고싶을때 ,극장에 상영중인 영화 다 봐서 더이상 볼거 없을때도 보기 힘든영화. ",2
근래 본 한국영화중에 모든 부분이 최고로 훌륭함 ,10
,10
다소 무거운 주제를 재미있고 긴장감 있게 풀어서 잘 봤습니다. 예나 지금이나 정치하는 사람들의 사리 사욕으로 나라가 이 모양인걸 생각하니 속에서 부글부글 화가 끓네요. 당시 외환은행 은퇴자 및 가족들이 얼마나 힘들었을까 하는 생각이 듭니다. ,9
이 영화의 어느 부분을 좋다고 해야하나? ,1
한석규배우님 최민식배우님 연기력이 우와마지막에 완전 감동 이 영화 강추합니다!!! ,10
말도안되는 지진 설정하며 시간에 쫓겨 만들었다고 대놓고하는 편집컷이며 남의 영화 베끼기 바쁜 클리세며 ...배우들 연기가 아까운 작품. ,3
주저하지 않는 연출로 긴박감을 잘 유지 시켜주는 영화네요 ,10
,10
보길 잘했다 최민식 연기 너무 잘해... ,10
감독이 에머리히인게 강점이자 단점..입체감 부족한 유치한 캐릭터들과 마구잡이로 잘라낸 편집의 능력치가 합처져서 갈팡질팡 중심 못잡는 이야기 구조는 전쟁씬의 짧은 스릴을 빼놓고는 평할만한 작품이 안된다. ,4
최고 최고. 두 남주 연기 최고. 크리스찬 베일 존멋 사랑합니다. ,10
넘 기대하고 봤나봐요. 댓글 감안하고 봤는데 졸았어요. 심지어 안 자려 노력했는데 잤음... 내 옆에분도 끝나도록 주무심. 발레동작 잘하지만 비슷한 동작반복 목소리는 좋았지만 큰 감동을 주진 못해서 지루한가 싶음. 뮤직컬 보러가기 전 자막봤다 생각하려구요 ,6
유치한건 전혀 상관없는데태양신 라 변신 cg가 최악 ㅋㅋㅋㅋcg 제작자금이 부족했나..? ,8
여자친구랑 같이 봤습니다.여자친구와 함께여서 재미있었습니다.여자친구와 함.께.여.서 ,3
,7
뮤지컬영화는역시내타입이아닌가보다 ,6
,10
돈 아까워요.욕은 왜 그렇게 마니 합니까?멀 말하려는건지 .. 밑도끝도 없는 영화. ,1
,7
,10
미드웨이 볼만했음  근데 이걸본뒤 진주만을 다시봤는데 진주만이 진짜 잘만들었구나 싶더라 ,8
뻔한 프레임에 비해 연출과 대사 잔가지에 손 들어줄 수 있는 편. ,8
개연성 전혀 없고 재난 감동 정치 뭐하나 제대로 표현하지 못한 짬뽕영화 이배우들로 이런영화를 만든게 아쉬울따름... 골든슬럼버 봤을때 진짜 개연성이너무떨어져서 재미없었는데 알고보니 이것도 같은감독이였음.. ,1
"재미없음..,이래서 할리우드 영화만 본가봄 ㅠ ",2
"그럴듯한 장면 몇개만 생각해놓고, 그 중간중간을 잇는 모든 개연성이 개그/코미디 입니다. 만약 이 영화를 재밌게 보았다면 그건 단순히 개그코드가 맞았을뿐, 이 영화가 뛰어난것이 아닙니다.애초에 주제가 글러먹었어요! 백두산을 막는데 주변에서 핵을 터뜨려 막아? 핵이 만만해?! 애초에 화산이 났는데, 그 주변 광산은 왜 안 무너져요?그리고 배우 배역도 좀... 안 맞는것 같아요. ",1
,10
숨도 제대로 못 쉬고 봤습니다. 그 시대 때 목숨 걸고 용기와 투지를 가지고 전투하신 제군분들께 진심으로 경의를 표합니다. 이런 영화가 진정한 영화가 아닐까 생각이 드네요. ,10
쫄깃하게 잘만들었네ㅋ  일본심기안건들려 노력한티가 많이나지만ㅋ  미군이  이기고도  진듯한 느낌은모지ㅋ ,8
전하의 나라가 보이옵니다.. ,9
,8
긴 호흡임에도 한번의 막힘없이 끌어가는 힘이 대단한 영화. 진짜 대단하다는 말밖에... ,10
배우들 연기는 최고지만 다큐멘터리같았어요 지루함 ,4
"영화 자체의 만듦새를 논하기전에, 이 영화는 나는 저 인물들보다, 나는 저 배우들보다 열심히 살고있는가라는 의문을 갖게 만들어줬다. ",8
정말 리얼리티 삼류작 ,1
정말 리얼리티 삼류작 ,1
정말 리얼리티 삼류작 ,1
아이들과 같이 봤어요. 저도 남편도 지루하지 않았어요^^ ,10
한석규 한석규 한석규 최고의연기 ,10
전 1편에 비해 그냥 그랬어요 ,8
너무 재밌다ㅜㅡ 재밌어~~~~ ,10
전편만큼 화려하다 안젤리나 졸리는 역시 이쁘고! ,10
5살 아들램과 같이 보러갓어요. 생각보다 집중도 잘하고 잘보더라구요.ㅎㅎ 하늘도깨비 말투가 넘 신선 ㅋㅋ 잼나네요. 다들 강림이가 멋잇긴하네요~~~~^^ ,8
,10
아무 생각없이 보면 재미있게 볼 수 있는거 같아요~^^ 깊게 생각하지 말고~^^ 재미있는 부분도 많고~^^ ,8
전쟁 영화를 볼 수록 반전주의자가 되어야한다. ,9
영화를 보는 내내 고흐가 된 듯 했다. 그래서인지 그 외로움에 영화를 보는 내내 몸서리가 쳐졌다. ,10
"저는 남자인데  책,영화 둘다 보고 너무 감명깊게 봤습니다. 영화는 보고 눈물 이 주르륵... 그시대 어머니들 현재 여성들에 대해 좀더 알수있게되어서 무척 좋게 봤습니다.ㅠㅠ ",10
여러 요소들이 무난히 배치되어 있지만 강렬함은 없는 ,6
재미나게보았네요 ,7
"허술한 이야기 전개, 개연성 없음연출과 편집의  부재.총체적 난국...특별출연 전도연부터 배우들의 연기와 노력이 너무나도 아까운 영화 ",2
3번째 인생 영화 탄생~ ,9
그냥 배우들이 연기를 다 잘했다. ,10
,10
,10
Show yourself 감동적입니다 ㅜㅠ ,10
중간까지 오~ 끝나니 엥? ,8
1분도 쉴틈없이 정말 감명 깊게 봤습니다 ,10
연기 영상 스토리 뭐하나 빠질게 없었던 영화 ,10
한글로 댓글을 쓸수 있게 만든 세종대왕님 감사합니다. ,9
초등학생때 봤던 겨울왕국이 2가 나왔서 바로 봤다...겨울왕국2는 더 뮤지컬스럽고 2번 봐서 더 좋았다 ,10
배우들이 불쌍하다. 어쩌다가 북한 선전하는 반미 영화에 출연했는지 큰 실망이다 ,1
,10
배우들의 연기가 훌륭합니다. 지금 우리나라와 주변국을 둘러싼 핵문제에 딱 맞는 흥미로운 주제도 좋습니다 ,8
"일본이 처참히 당하는 영화인줄 알았단건 그만큼 역사교육을 잘못받은거. 우리가 맨날 일본 무시해도 진주만 공습 당시 일본은 태평양에서 절대 못건드렸음. 저시대에 항공모함도 만드는 기술력이었고, 특히 일본 전투기는 세계쵝ㅎ 기술력이었음. 한국인들아 인정을 해야 발전이 있다. 떨어지는 상황에서 무시하는건 그저 열등감 표출밖에 안됨 ",10
상우형 발음 여전하구나... ,6
좋은 소재를 쫄깃하게 만들지 못해 많이 아쉬웠으나 CG는 좋았고 나름 재밌게 봤음...다모폐인으로 이병헌 입으로 다모얘기 여러번 들을 수 있어 엄청 좋았음.완전 좋았음.ㅎㅎ아프냐. 나도 아프냐라는 명대사까지.^^.역시 명작은 남북을 가리지 않는구나...ㅎㅎ아~ 이 영화는 한국영화지...^^ ,7
스토리부터 영상미까지 전부 완벽했던...내 인생 최고의 애니메이션 영화!!! ,10
제가 웬만해선 영화보고 잘 안우는데 천문은 가족앞에서 역대급으로 운 영화네요.... 가족들이랑 봤는데 정말 재밌게 잘 봤고 감동적이였던 거 같아요.. 보시길 추천합니다!! ,10
세종대왕의 위대함은 그 확고한 국정철학과 지성.현실적인 정치감각이다.근데 후손들은 그저 맘 착한 아재정도로 생각하네. ,5
Ost가 좋고 감동적임 ,10
,10
더 화려해진 볼거리 하지만 그것을 커버할 수 없는 엉성하고 나사빠진 결말 ,5
진짜 제발 보지마세요ㅠㅠㅠ ,1
솔직히 기대보다  별로였어요 ㅠㅠ ,6
영화가 일깨워주는 사랑 . 관찰자 시점에서 보는 아름다움. 상처받기 싫어서 내겐 너무 어렵기만한 사랑. 용기가 필요하네요 ,10
"인간적으로 웃고, 울고는 아니다그러나 백두산보다 재밌으면 된거야~돈은 안아까우니까... ",8
최근에 본 영화중 감동과 재미를 모두 갖춘영화였어요 배우님들 모두 연기력이 어마무시하십니다  천만 꼭 기원합니다 ,10
