text,star
영화 잘 만들었네평점이 높아서 봤더니 스토리도 막힘없이 술술 전개되고 마지막 아저씨의 해설도 아주 좋다 ,10
초반 가마씬에서 사도의 오프닝씬 느낌도 나고 흥미진진했지만 중후반부는 매우 루즈했으며 뒷자리 아저씨가 코를 골고 주무셨음에도 영화를 끝까지 본 나에게 박수.. 연기 정말 좋았는데 거의 장영실과 세종의 사극 로맨스 수준 서사였다 놀람의 연속 ,8
"참, 재미있는 영화이고 의미 있는 영화다. ",10
1편보단 아쉽다. 하지만 겨울왕국이다. ,9
권상우님의 인생작이다. 추천 오지게 박고 갑니다. ,10
상철 연기가 진짜 연기지 솨라잇네 ,7
두사람의 내면연기 볼만했슴 ,8
그냥 직접 보세요. 영화관가서 봐야 사운드와 함께 스릴과 감동을 제대로 느낄 수 있음. ,10
아니 이게 10점짜리 영화지 평점이 왜 9점도 안되냐ㅡㅡ ,10
20년전 영화라고 안믿어질만큼 영상미와 스토리 음악 너무 재밌게 잘봤습니다. 마음이 따스해지고 힐링받는 느낌이에요 ,9
보지 않을래야 않을 수 없는 영하 ,10
주말저녁심심해서뭐볼까검색하다긴4.0이라서눌렀는데어떻게이영화가않뜬거죠?ㅠ너무잼있게봄 박해수씨 연기도찰떡이였고 이런스타일연기본적없었는데최고^^ ,10
말이 필요없는 최고의 영화... ,10
네이버 후기보고 보러갔는데..몇번졸았네요. 흐름이 너무 쳐지고억지설정때문에 부자연스러운 스토리였음 ,6
아니 중반까지는 좋았는데.. 애기를 대신 낳자는 것까지는 이해가 됐는데 여주 죽는 시나리오는 좀 뜬금없었음.. 코르넬리우스 불쌍 별로 추천하고 싶지는 않은 영화 ,5
응디응디마매끼놔라마감사합니다.부엉이바위 로가자으아~ ,1
일단 인간이 바이러스라는 스토리 매우 신선했구요 소재는 너무 맘에들었어요 근데 너무... 영화제작하신 분들께는 죄송한말씀입니다만 진짜 어설퍼요 Cg 빼고는 아무것도 없습니다. 캐릭터며 연출이며 내용전개 등 몇몇부분 연기까지 아주 난장판이에요 딱 90년대 올드한느낌의 전개인데 도저히 공감을 못하겠는 캐릭터들의 행동덕분에 몰입도도 많이 떨어졌고요..초중반까지는 cg보다 인물들이 좀 더 많이 나오기때문에영화보는내내 그만보고 싶다는생각 수십번도 더했는데 cg는 정말잘뽑아서 최소 그부분이라도 좋아서 안끄고 끝까지 다봤네요.. 정말 cg가 멱살캐리 합니다 연출이나 전개는 디워급이에요 보다보면 짜증이 납디다... 특히 애엄마.... ㅆ cg 전투씬 좋아하시거나 연령대가 어리시다면 추천드립니다. 그게아니라면 시간아까울수있어요... ,1
,10
,10
영화로 먼저 봤지만 책으로 나온것도 보려구요 보는내내 엄마가 많이 생각났어요 그래서 눈물이 많이 났구요 공감이 많이 가는 영화였어요 ㅜ ,10
내생에 최고의 영화 입니다. 내용도 좋았고 이 영화에 나오는 모든 배우들의 춤과노래가 환상이었습니다. ,10
제목을 아메리칸 갱스터가 아니라 아메리칸 마약상으로 바꿔야 할듯..지루한감이 있는데 실화라서 참고 볼만함 ,8
,10
4D로도 나오면 좋겠음 존잼탱구리 ,10
,10
스토리가 빨라 자칫 2차대전 진주만 액션생각하시고 보시면 정리가 좀 안됍니다 공부좀 하시고보면 그때 했던 역사적 사실들 일본과 미국의 친분과전쟁 이후 패전 요인들을 아셔야 꿀잼있게 보는 방법임... ,8
"극장 속 흑백영화가 더 재미 있었다매단 실이 훤히 보이던 그 뱀이 이 영화의모든것을 상징하는듯 하다허무주의,포스트 모더니즘의 극치남주인공 어머니가 저걸 봤으면저 여주인공은 어이 되었을까저 좋은 배우로 아 ... ",1
진짜 미쳤냐... 와 오랫만에 정말 영화다운 영화를 봤다.... 이게영화지... 하.... 진짜 그리고 또 드는생각 일본은 ㅈㄹㅂ안하는데가 없네 나쁜일에는 다 껴있고 난리 그거보고 한번 더 열받았다 ,10
배역은 안어울리고 연기는 진부하고 소재는 식상하고 ...꼭들어가는 신파에다가...보기 거북한 브로맨스까지... ,1
아....영화 다보고나면똥싸다 중간에 끊긴 기분임...영화관에서 보면 돈아까움... ,6
,10
네이버는 베스트 한줄평이 대놓고 스포일러를 하네 수준 진짜 낮다ㅋㅋ ,10
,10
백두산포발을 북한과 합동으롳막는다더니  어디 그런게 나와? 허상만 가득한 돈 아깝고 눈버린 영화다.내가 본 영화중 최악이다 ,1
"휴가복귀날에 봤던 영화.점심 다돼가는데 보는 사람 6명..나랑 형, 모르는 아줌마랑 애 2쌍...차라리 그 시간에 운동하는게 나을 정도.... ",2
,10
부내와 가난의 냄새를  나는 안다 초등학교 시절 부내와 가난의 냄새를 알았던 나는 내가 그 어디에도 속하지 않는다는걸 감사했는지 모른다 ,10
좋아요. ,10
헤어져보아야만 알 수 있었던 관계. 그 헤어짐의 과정이 너무 잔혹하다. ,8
인생영화입니다. ,10
최민식의 연기가 기억나는 감성적영화 ,7
창정이형이니까  그나마 6점이다. 아니  다르나라도  아니고  한국에서  어떻게  총기를 구할수있단 말인가.... 그것도.. 극중  고아 3명이 .... 총기무장강도라는 설정자체가  한국은 무리수.... ,6
"시즌1만큼의 초초띵곡 임팩트는 없어서 아쉬웠지만 전체적으로 영상미가 굉장히 발전했고 OST 하나 하나의 퀄리티는 정말 좋았습니다. 애초에 스토리 측면은 하나 하나 구현해야 하는 그래픽 애니메이션 영화 특성상 실사 영화에 비해 매끄럽지 못할 수밖에 없는 것을 감안했을 때 이번 것도 정말 명작입니다. 시즌1의 스토리와 억지로 엮은 것도 아니었고, 선작만한 후작은 없다는 클리셰를 OST측면에서만 제외하고 모든 면에서 극복한 느낌. 만약 시즌1에서의 순수한 사랑을 노래하는 Love is an open door, 그리고 설렘과 애상을 담은 For the first time in forever과 같은 초-띵곡에 대적할 만한 멜로디를 가진 OST만 있었다면 준-2천만도 가능했을 만한 영화라 생각합니다. ",10
"연기도 좋고,  시사성도 좋고,  재미도 있고~~ ",10
한 장면 한 장면이 독특하고 기발한 영화 이 영화 창의력을 따라갈 영화는 없지 싶다 ,10
이병헌 연기는  신이다  감상포인트는 이병헌 연기임 ,8
기대에 대한 심한 배신감을 느끼게한 영화 ,2
,10
"이렇게 탄탄한 영화도 오랜만인듯,,배우들의 연기도 연출도 굿잡! ",7
"'응답하라 1969', 그 시절, 할리우드에 바치는 찬가 ",7
거 눈알이 너무 큰거 아니오 ,7
생각해보니 내가 정말 좋아하는 애니메이션 ,10
이런건 꼭 봐줘야지~~ ,10
적당히 볼만했네요~~~ ,8
다들 영상에 감탄하는데 책으로 읽었다면 어땠을까를 생각해보면 그또한 두근거린다. ,8
아이들 모두 귀엽고 연기도 잘해요. 잔잔한 이야기가 좋았습니다. 근데 딸이랑 엄마의 대화가 중고등학생 딸과 엄마의 대화 같았어요ㅋㅋ ,10
왜 이걸 영화관에서 안봤나싶네요. 연기력은 물론이고 와 감독 천재입니다. 개연성은 조금 떨어지지만 왜 가만있었나싶기도 했지만 입이 떡 벌어지는 결말입니다. ,10
대규모 전투신을 보여줘야 하니 조잡한 CG와 등장인물이 너무 많아서 내용이 부드럽게  이어지질 않음. 그리고 뻔한 미국승리 영화.나중에 dvd로 보는것 추천. ,6
쿠키영상 보고 나오세요 ,7
메시지에 취중하다보니 스토리는 다소 아쉬워진 느낌. 그럼에도 불구하고 겨울왕국은 옳다. 1편에 비해 노래의 비중에 더 늘었다. ,8
스토리 탄탄하고 반전에 반전!! 간만에 너무 재밌게 봤다 ,10
"제대로 된 공포영화가 아님. 공포영화를 가장한 B급 액션 영화... 어떤 영화인지 알고 보면 나름 발상의 전환을 신선하게 봐줄 수 있으나, 그걸 모르고 보면 짜증남. 장난치는 건가 싶고... 하나도 안 무서움. ",2
단순히 슬퍼서 눈물이 나는 장면도 있지만 배우들의 감정선을 잘 표현해낸 연출이 돋보이는 영화 였습니다. 상영이 끝나서도 감정이 계속 유지되며 장면들을 계속 떠올리게 되더라구요! 최근에 본 영화 중에 최고라고 생각합니다 ,10
아줌마 본명 '타부' 실화냐. ,8
,10
,10
크으... 지렸다 ... 연기.. 지렸다.. ,10
아니 어떻게 정상인이 이런 영화를 만들죠? 그 어떤 욕도 부족한 영화네요 시나리오가 쓰래기인데 감독이 정상이 아니면  주변에서 말려야죠 감독은 대체 멀 말하고 싶은거죠?카메라 감독님 머했어요 도저히 못하겠다고 해야죠! 스텝들 다 머한거야 웃음 참으면서 일한거야? 청정명 니가 제일 나쁜 새끼야 ,1
상상하고 원하던 그 남쪽으로 도착했을까 ,9
너무너무 기대를 했나봐요. 네이버영화 평점 9.3점 만큼은 아니었어요 ㅎㅎ 근데 영화 속 음악은 정말 좋았습니다~ 배우들 연기는 당연 좋았구요^^ ,6
영화 진짜 잘만들었네 후회안한다 꼭 봐라 ,10
"인생이란 무엇일까...우리는 왜, 어째서, 무얼 위해 사는걸까? ",10
해로운 영화 걱정됩니다 ,1
억지개그 떡칠. 이상한 전개. 클리셰 범벅. ,1
좋앙 ,10
두 시간이 이렇게 짧았나 싶을정도로 재밌게 봤어요. 상남자들의 멋짐 ,10
처음으로본걸 중국으로봤는데나름괜찮았어요 일본판도봐야겠어요:)개인적으로 배우들연기도괜츈~~ ,10
평점 높일 필요가 있는듯해 10점 줍니다. 마케팅이 잘못돼서 영화를 망친 케이스. 멜로에 초점을 두고 봐야 하는데.. 다만 정사씬 적당히 했으면 좋았을것 같네요.. 너무 자주 나왔음 ,10
최고급 랍스터랑 전복을 넣고 라면을 끓여버렸네.. ,1
"보는 동안 영화는 나에게 어떠한 감정적 소모도 요구하지 않는다.걷지 않아도, 눈을 감지 않아도, 따분하지 않아도, 기술을 알지 못해도 깊은 명상을 한 것 같은 힐링을 하는 방법이 있다는 걸 알려주는 영화다. ",8
중국판도  괜찮네요미루다미루다봤습니다 ,10
일본은 한 때 참 무모하게 패기로웠구나 + 미국은 잠자는 거인이구나+현재 우리가 살고 있는 시대보다 평화로울 수 없는데도 아직도 평화를 외치는 자는 의심해야함 ,8
정말 잘 만든 영화.  오열하며 봤어요 ㅜㅜ ,10
,10
작품성 어쩌고 떠나서 이정도면 충분히 극장에서 볼만한 영화라 생각됩니다. 추천합니다. ,10
"영화가 나온지 30년이 지난 지금에도 여전히 큰 울림을 주는 건, 여전히 영화에서만 볼 수 있는 영화같은 얘기일 뿐일지도 모르겠다. 그래서 더욱 보석같은 영화. 배우들의 젊은 모습을 보는 것도 꿀잼. ",9
대박이요..영화보고 눈물이 멈추지않네요감사합니다.. ,10
"""당신은 내가 더 좋은 남자가 되고 싶게 만들어요""개인적으로 확인 강박증을 2년 가까이 겪었어서 작중 멜빈이 얼마나 큰 용기를 냈고 기뻤을지 나의 일인 것처럼 와 닿았다. 저렇게 성격 고약한 인물이 매력적이기 쉽지 않은데 츤데레의 힘이 대단하다. ",9
윤석이이빨갱아재밋냐? ,1
무슨 검사가 막가파 수사밖에 할 줄 모르냐그래도 검사인데 빡대가리로 설정해놔서 몰입도떨어짐 ,4
,8
아름다운 사람입니다. ,10
인생영화꼭 보세요. ,10
,10
시나리오가 개 OO임 와 좋은 배우들 데리고 OO창 냈네 ㅄ ,1
실화라는게 더 놀랍네요. 웃기기도 하고 ㅋㅋㅋㅋ ,10
용기 있는 모든 행동들과 그 행동들을 기리는 모든 이들을 위하여 ,9
 정말 역대급이네요. 전쟁의 뼈아픔을 제대로 느끼게 해주는 영화. ,10
이연걸 인생 영화임수십번은 본것같은데 볼때마다 재밌음 ,8
왜 최고의 영화라는지 알겠네요. 굉장히 재밌습니다. 감동적인데다가 유머스러운 모습도 있고 아무튼 최고! ,10
레알 팩트 리뷰 : 시동만 걸다 끝 ... ,2
"일본이 죽도록 싫지만서도 자기 나라에 대한 충심과 잔혹성, 미국을 상대로 이길 수 있을 거란 대범함이 어쩌면 우리나라가 배워야 할 점이 아닌가 싶다. 그리고 무엇보다 조선이란 나라가 정쟁을 뒤로하고 문호개방을 일찍 했더라면... 하는 개인적으로 씁쓸함이 많이 남는 영화였다. ",10
병맛인척하는 명작임ㅋ주성치 싫어했는데  이시리즈랑   쿵푸허슬보고  대단한배우임을  알게됨 ,8
사대부와 명나라에 맞서싸우는 왕과 천재가 외로운 싸움을 외롭지 않게 완성한 우정에대한 최민식 한석규 그 이상의 연기. ,10
비주얼은 1편보다 훨씬 좋았다. 하지만 그뿐이다. 스케일이 커진만큼 비주얼의 퀄리티 또한 상승하는건 당연하다. 하지만 1편 만한 2편은 없다고 2편은 좀 많이 아쉬웠다. 2편 보고 나서 1편을 다시 봤는데 2편은 개연성이라든지 극의 흐름이 자연스럽지 않은게 느껴졌다. 2편은 기억에 남는 거라곤 비주얼 밖에 없다...딱 애들의 시점에 맞춰져 비주얼은 진화하고 작품성은 퇴화 한듯한 감상을 느꼈다. 1편이 얼마나 잘 만들었는지 알수 있게 됐다. 음악도 스토리도 극의 흐름도 1편이 훨씬 더 좋았고 자연스러웠으며 감동도 있어 여운이 남는 작품이였음. 2편은... 추천하진 않는다. ,5
 좋은 남편에 귀여운 딸도 있고 일하러 오라는데도 있고....도대체 어느 부분에서 공감을 해야하는지 모르겠다... 남자나 여자나 인생 꽃길만 걷는 사람들이 몇이나 되겠냐???인생 자체가 마라톤이다 오르막도 있고 내리막도 있는건데 이 영화는 뭐....차라리 초자연현상 영화라고 생각하고 봐야 마음편하겠다 ,1
다시 봐도 대단한 영화! 꼭 보세요 추천합니다 ,10
이상하게 후크 죽을 때 통쾌하기 보다 슬펐음 ,10
세종이랑 장영실 키스할까봐 조마조마하면서 봤다... ,10
마동석 얼굴 나올 때마다 웃었어요ㅋㅋㅋㅋ 생각없이 재밌게 봤던 영화입니다! ,8
재밋게 잘봤습니다 한석규 최민식 ,10
밀덕들은 좋아할만한 영화 ,6
스토리는 좋지만 촬영이 구렸습니다. 롱샷을 적절히 활용했으면 더 좋았을 것 같은데.. ,5
엘르 페닝 이때부터 진짜 이쁘네. 안젤리나 졸리는 연기 정말 잘한다. ,8
진부한 눈물쥐어짜기일지 몰라도 정말 많이 울었다 가족이라는 명사에 대해서 다시 생각해본다. ,8
눈물 펑펑나게 만드네.  두 배우들 연기가 압권. ,10
데뷔작이 이정도네ㄷㄷ ,10
다소 간지러울 수 있는 스토리였지만 간지러운 곳을 시원하게 긁어주네 ㅎ 이쯤되면 제라드 나오는 영화는 믿고 봐도 될 듯. ,8
,10
생각업고 철없는 오로라 ,3
인간은 한치 앞을 못 본다... ,10
현실 : 미국이 우리나라 먹여살리는데 북한은 지원해줘봤자 미사일만 ㅈㄴ게 날리는 은혜를 원수로 갚는 배은망덕한 놈들.현실을 못보는 개돼지들 : 빼애애액~ 미국 ㅈㄴ 나쁨! 암튼 나쁨! 북한 짱짱! 암튼 좋음! 빼애애액~ ,1
와.... 특수효과 죽이고 진짜 손에 땀이 나도록 봤다...  기억 속에 오래 남을 명작이다 ,10
전형적인 문정권 문화계 좌파선동물이시국에 남과 북이 하나되어 미제의 억압에서 벗어나 한뜻으로 힘을 모아 하나가 되어 난제를 해결한다는 시대착오적인 시나리오하정우와 병헌의 특유의 능청맞은 코미디가 만나 시너지가 됨.그러나 점점 길어지며 과유불급이 되감 한없이 약한 여성 수지.끝 ,1
정말 감동적이고 마음 따뜻해지는 영화입니다! ,10
남결영이 2018.년도에 세상을 떠났다니...!ㅠㅠ ,10
잔잔한.... ,10
초반이랑 후반 약간 설정이 다르지만 감동 재미 송승헌 얼굴 세가지로 용서가 됨 ㅋ ,8
뭘 의미하는지 모르겠는 영화배우가 연기 잘 한다는 것만 보기에는 시간이 아깝다감상포인트도 별로 고르고싶진 않았는데 억지로 하나 골랐음. ,3
오늘부터 포드 불매운동 ,10
연기가... 진짜 죽이고요... 이게 세종-장영실 서사 자체도 엄청나서 너무 재미있게 봤습니다... 근데 한석규 씨가 자꾸 멜로 눈빛 하셔서... 장르가 이게 맞나 하고 계속 갸웃거렸네요... ,10
스토리 ㅠㅠ 육점연기 사점ㅠㅠ 솔직히 그냥 쏘쏘 연기가 좀 그랬어라너무 티나부러야 사투리도 그렇코꼭 졸업작품가타 부러야 ,6
아무리 다시봐도 이런 OO졸작은 왜 탄생했는가.. 좃좃브람스 이 OOO년 ,1
"☆어이상실 포인트☆1. 한국이랑 북한이랑 중국이랑 한편이며, 미국이랑은 싸움2. 백두산을 잠재기우기 위해선 북한의 핵이 필요함북한에 대한 긍정적인 인식을 느끼게 하려는 영화인것 같음 ",1
검사들의 참모습이네 지금 윤석렬이 하는짓거리구나 ,10
두 말이 필요없는 진정한 전쟁 영화!! ,10
개존잼 근 1년동안 본 영화중 가장 재미있었다. 뭣 같은 스크린독점 탓에 이런 걸작을 더 많은 사람이 볼 수 없다는 게 아쉽다 ,10
고려의 신돈이 생각났다...잔은 진정한 영웅인가?마녀인가?...신돈은 진정한 백성을위한 재상인가?여우인가?.. ,8
애국평점 뻥튀기에 속았다. 억지감동 유도 쩔고 스토리 질질 늘어지고 대사 자체도 세종 장영실 게이물인가 의심스러울 정도로 오그라듬. 걍 신파극 그자체. 스토리 절정부분도 긴장감 하나도 없이 지루함. 세종이 이룬 업적이 얼마나 많은데 장영실 하나에 한글창제 연결짓는 무리수까지. 간간히 들어오는 유머는 하나도 안웃겨서 짜증날 지경. 난 관상 정도는 될줄알고 봤는데 진짜 개실망이다. 보니까 신인감독 티가 팍팍 나던데 비슷한걸로 배울려면 그나마 광해보고 좀 배워라. 애국스토리로 날로 먹지말고. 걍 평점에 속았다 ,1
엄청난 배우들의 연기로 좋은 스토리를 가져가니 너무나도 재밌던 영화 ,10
ㅠㅠ너무 뻔하고 억지감동이 심한 거 같았어요.. ,1
Nwa 랩퍼들이 뭔가 대단한 천재인거 마냥 랩 연습 같은 거 하나도 안하고 바로 랩 녹음 했는데 바로 명곡이 된것 마냥 그러지는 게 쫌 별로였음 ,8
1보단 당연 재미는 없는데 나쁘지않았음. 근데 평점이 너무 낮네요  저정돈 아닌데 ,8
미루고 미루다 봤는데 딱 맞는 계절! 1년정도 늦었지만 올해 시작을 그린북과 함께 할 수 있어서 기쁨 ,10
저기가서 선동당햇던 사람들이 다 지금 늙어서 시청에나오는거구나. 아!그렇구나.  다들 제정신이 아닌거알겟는데 이거보니 알겠구만. 시청에서 일하고 있는 1인이데 촛불집회부터 지금까지 쭈욱 보고 느낀점은..그냥 좀...약빤사람들같음. 나이가 많고 늙은건알겠는데 기본 개념이나 뭐 그런게없음. 그냥 뭔가에 홀린 사람들같음. ,10
이병헌 반전 완전 감동임 친구 말 듣고 안봤으면 후회했을거임 ,10
에라이~  푱식이  ☜ 어디가나 엉터리 시를 써대고 가는구먼  쩝... ,10
,10
BL 그 이상 그 이하도 아님 ,6
난좋았는데ㅠ감독님 파이팅 ,10
전쟁영화 관심 없었는데 진짜 재미있게 봤어요! ,10
,10
"인생 최고의 한국영화.""아름다운그녀"" 이후 이병헌씨를 평생 좋아하게 될 계기를 만들어 주었다. ",10
,10
공주 1급 발암물질. 스토리 개연성도 개판. 딱 애들영화 수준임. 그나마 영상미는 좋아서 6점. ,6
이런거 믿는놈들이 드루킹은 왜 안믿냐 ㅋㅋㅋ ,1
보지는않았는데별로보고싶지는않쿤요?웬지 빨갱이 냄새 물씬우리의주적은부칸입니다^^ ,1
,1
"일반인들이 좋다고 하는 영화는 낮추어 평가해야 본인들의 가치가 높아지나봐요. 풉, 꼴에 ㅋㅋㅋ 나도 키보드만 있으면 평론가~ ",10
고전 영화라 요즘 영화에 비해 지루할 수 있다 그러나 그 안에 담긴 아름다운 영상미와 스토리가 말로 표현할 수 없을 정도로 아름답다 마지막 엔딩 때 토토의 표정과 그 감동은 잊을 수가 없다 엔딩의 감동은 나이가 들며 볼수록 더욱 진해질 것이다. 그리고 love theme는 엔딩 장면과 너무 잘 어울리는 ost였다 한 사람 인생의 거의 모든게 다 담겨져있는 영화와 엔딩 그리고 음악 ,10
이 영화 DVD가 저에게 있다면 그것은 가보가 될것입니다 ,10
재밋써요 재밋써요오ㅎㅎ ,10
본격 하정우 입덕 영화ㅠㅠ이때까지 영화에선 멋지고 섹시한 모습이라서 좋아했었는데 이번 영화에선 귀엽기까지ㅠㅠ보고 좋아서 미치는 줄 알았어요ㅠ글고 스포당해서 별로 울진 않았는데 스포 안당했으면 엄청 울었을듯! ,7
"현실적인 여성의 힘든 것들을 많이 담고있는 영화같다. 하고싶은 것들을 포기하고 누구의 엄마, 아내로 사는 그런 내용인거같다... 영화 중간쯤에 엄마(김미경배우님)가 딸(정유미배우님)이 아픈걸알게되고 딸집에 찾아갔을때 딸이 빙의되어 얘기하는 장면이 넘 슬펐는거같다..! ",10
딸들이 좋아라 하니 좋은가 봅니다애니매이션볼때마다 졸았는데 다행히 고비 넘겨서 잘 봤네요 *^^* ,6
여기죄다 알바냐ㅋㅋㄱ 난진짜 역대급영화본느낌이다 불광cgv에서봣는데 개꿀잼 ,10
,10
평점이 너무 안좋아서 걱정했는데 존.나 야하고 재밌다 둘의 감정선에 집중해서 보면 시간가는줄 모름 다음편이 안나왔을때라 결말때문에 사람들이 욕한듯 다음편 보러가야지~! ,10
감동적이에요 천만 간다고 봅니다 ,10
"기대안하고 봤는데 내용과 연기가 너무 멋졌어요하지만 마지막 엔딩이.. 왜그렇게 끝나나요해피엔딩 기대했는데 .. 크리스찬베일, 멧데이먼의연기도 좋고 스릴있게 재밌게 보고있다가 허무하고 씁쓸하고 힘빠지는 영화.. ",6
던전을 발견하기 위한 여정과 추적하는 게임의 요소가 흥미롭다.후반은 시시한 면도 있지만 꿈꾸는 청소년들의 성장기 심리적 상태를 꿈같이 두루뭉실하고 가볍게 잘 날려준거 같다. ,8
내가 새콤달콤한 비타민 1000개 사줄게요 살려내 ㅠㅠㅜ ,10
진짜 장난하나. 마지막은 안봐버림. 스토리전개가 너무 허접스러움. 감정이입이 방해되는 요소가 지나치게 많음. ,6
"""저 옆에 작은 별이 네 별이다."" 한나라의 지존이 제일 무시받고 제일 낮다 여겨지는 천민에게 스스럼없이 벗이라 말하고 함께 나란히 별을 보며 꿈을 이야기 한다는 것,세종 당신이 있어서 우리가 있습니다.당연하게 여겨졌던 것들 중 그 어떤것도 당연한 건 없었습니다. ",10
밀덕에게는 최고의영화다. 스토리는필요없다 이미아니까 ㅎㅎ ,10
"""이건 당신이 펴. 나는 피는 법을 모르거든."" ",10
이 전쟁으로 인해서 우리들의 광복이 있을 수 있었습니다 보는내내 벅차고 감동이었습니다 다들 이거 보세요 ㅜㅜ 역사에 대해 더 알수있고 좋습니다 ,10
손에 땀이 날 정도로 박진감 넘치고 너무 재미있었습니다 ,10
뭐야 용엄마였네 개추지이건 ,10
합법이니 자수성가니 하지만.. 결국에는 내꺼는 안돼! ,8
여자친구랑 잘 봤습니다. 십여년전 처음 봤을때의 여운만큼이나 신선하고 감동적이었습니다. ,10
아오 맘조리면서 시간가는줄 모르고봄 ,8
가문의 영광을 위하여!! ,10
정말 뭐 협찬이고 알바건 다 떠나서 진심으로 돈이 아까운 영화는 첨이었다 연출진짜 갑자기 중반이후에 평화로워지더니 마지막은 갑자기 깡패를 싸대기로 끝내네 마동석이 갑자기 뜬금없이 짜장면 만들어주곸ㅋㅋㅋㅋ평점 높아서 봤더니 진짜 이런것도 저런 평점주나 싶네요 ,1
가족이 되어가는 이야기. 일본 특유의 담담한 모습. 책임감 강한 맏이가 안쓰러웠고. 자신의 잘못이 아닌데 태어난 막내의 어른스러운 모습이 안쓰러웠다. 눈치보며 살았을 인생. 이제는 새로운 가족들을 만나 제대로 막내처럼 살아가자. ,7
가족이 되어가는 이야기. 일본 특유의 담담한 모습. 책임감 강한 맏이가 안쓰러웠고. 자신의 잘못이 아닌데 태어난 막내의 어른스러운 모습이 안쓰러웠다. 눈치보며 살았을 인생. 이제는 새로운 가족들을 만나 제대로 막내처럼 살아가자. ,7
,10
참 지독하게 현실적인 영화같다. 지루할 뻔한 영화를 배우들 연기로 다 이끌고간듯. ,8
뭐하나 빠지는게 없음 최고 ,10
